tweet|covering_link
"DC protesters have set up a “guillotine” in protest of Jeff Bezos in front 
of his complex in DC "|https://news.google.com/stories/CAAqOQgKIjNDQklTSURvSmMzUnZjbmt0TXpZd1NoTUtFUWlaa2Q2UGtJQU1FZTFpVzBCUUZIY3VLQUFQAQ?hl=en-US&gl=US&ceid=US%3Aen
"It is utterly disgraceful that @JeffBezos and @washingtonpost are 
profiteering off #coronavirus coverage. "|https://news.google.com/stories/CAAqOQgKIjNDQklTSURvSmMzUnZjbmt0TXpZd1NoTUtFUWlaa2Q2UGtJQU1FZTFpVzBCUUZIY3VLQUFQAQ?hl=en-US&gl=US&ceid=US%3Aen
"Chesapeake has filed for bankruptcy, which means the naming rights for 
Chesapeake Energy Arena will be up for sale... @JeffBezos, you need another 
Climate Pledge Arena? How about Stolen Supersonics Arena?"|https://news.google.com/stories/CAAqOQgKIjNDQklTSURvSmMzUnZjbmt0TXpZd1NoTUtFUWlaa2Q2UGtJQU1FZTFpVzBCUUZIY3VLQUFQAQ?hl=en-US&gl=US&ceid=US%3Aen
"The H1b system has only been around since 1998 and has been riddle with 
more fraud, waste, and abuse than even Joe Biden’s career in public office. 
"|https://news.google.com/stories/CAAqOQgKIjNDQklTSURvSmMzUnZjbmt0TXpZd1NoTUtFUWlScTlPUWtJQU1FY0h1eFZsLWlJZlRLQUFQAQ?hl=en-US&gl=US&ceid=US%3Aen
"Trump’s H-1B ban has enormous costs for the people caught up in it. 
⁦@russellbrandom⁩ talked to four of them: "|https://news.google.com/stories/CAAqOQgKIjNDQklTSURvSmMzUnZjbmt0TXpZd1NoTUtFUWlScTlPUWtJQU1FY0h1eFZsLWlJZlRLQUFQAQ?hl=en-US&gl=US&ceid=US%3Aen
"""Whichever way you slice it, immigrant scholars (including those on H-1B 
visas) create and do not “steal"" U.S. jobs."" Important @Neubadah piece. 
"|https://news.google.com/stories/CAAqOQgKIjNDQklTSURvSmMzUnZjbmt0TXpZd1NoTUtFUWlScTlPUWtJQU1FY0h1eFZsLWlJZlRLQUFQAQ?hl=en-US&gl=US&ceid=US%3Aen
"How Trump’s misguided H-1B visa ban will devastate our economy – Fortune 
"|https://news.google.com/stories/CAAqOQgKIjNDQklTSURvSmMzUnZjbmt0TXpZd1NoTUtFUWlScTlPUWtJQU1FY0h1eFZsLWlJZlRLQUFQAQ?hl=en-US&gl=US&ceid=US%3Aen
"I never thought that Bahrain would be leading on the Gulf region's economic 
response to COVID-19. Bravo to them. Bahrain to pay 50% of salaries of 
private sector staff "|https://news.google.com/stories/CAAqOQgKIjNDQklTSURvSmMzUnZjbmt0TXpZd1NoTUtFUWpPMGNxTmtJQU1FYlpMX0pXRk81S01LQUFQAQ?hl=en-US&gl=US&ceid=US%3Aen
"Today's the 2nd day of a 48h strike at Amazon warehouses in Germany. 
Workers calling for improved health & safety conditions. More than 2,000 on 
strike across six warehouses according to @_verdi union. 
"|https://news.google.com/stories/CAAqfggKInhDQklTVkRvSmMzUnZjbmt0TXpZd1NrY0tFUWlfNUllUGtJQU1FYXlFdFRWeG1NbHdFakpCYldGNmIyNGdkMjl5YTJWeWN5QnpkSEpwYTJVZ2FXNGdSMlZ5YldGdWVTQnZkbVZ5SUdobFlXeDBhQ0JtWldGeWN5Z0FQAQ?hl=en-US&gl=US&ceid=US%3Aen
"NEW: Amazon warehouse workers in Germany have gone on strike over a lack 
coronavirus safety measures. A recent warehouse outbreak infected 40-50 
workers, according to @_verdi. The strikes are happening just a few weeks 
after Amazon fired protesters in US "|https://news.google.com/stories/CAAqfggKInhDQklTVkRvSmMzUnZjbmt0TXpZd1NrY0tFUWlfNUllUGtJQU1FYXlFdFRWeG1NbHdFakpCYldGNmIyNGdkMjl5YTJWeWN5QnpkSEpwYTJVZ2FXNGdSMlZ5YldGdWVTQnZkbVZ5SUdobFlXeDBhQ0JtWldGeWN5Z0FQAQ?hl=en-US&gl=US&ceid=US%3Aen
"$AMZN Amazon to Pay $500 Million in Bonuses for Front-Line Workers, 
Delivery Partners "|https://news.google.com/stories/CAAqhQEICiJ_Q0JJU1dUb0pjM1J2Y25rdE16WXdTa3dLRVFqXzEtU1BrSUFNRWJpSFNMal9pNjlMRWpkQmJXRjZiMjRnZEc4Z2NHRjVJR1p5YjI1MGJHbHVaU0IzYjNKclpYSnpJQ1ExTURBZ2JXbHNiR2x2YmlCcGJpQmliMjUxYzJWektBQVAB?hl=en-US&gl=US&ceid=US%3Aen
"Amazon gives front-line workers a $500 coronavirus bonus 
"|https://news.google.com/stories/CAAqhQEICiJ_Q0JJU1dUb0pjM1J2Y25rdE16WXdTa3dLRVFqXzEtU1BrSUFNRWJpSFNMal9pNjlMRWpkQmJXRjZiMjRnZEc4Z2NHRjVJR1p5YjI1MGJHbHVaU0IzYjNKclpYSnpJQ1ExTURBZ2JXbHNiR2x2YmlCcGJpQmliMjUxYzJWektBQVAB?hl=en-US&gl=US&ceid=US%3Aen
"Amazon Logistics Workers Get a $500 Bonus 🛒 “Our front-line operations 
teams have been on an incredible journey over the last few months, and we 
want to show our appreciation with a special one-time Thank You bonus.” 
#ecommerce #EssentialWorkers "|https://news.google.com/stories/CAAqhQEICiJ_Q0JJU1dUb0pjM1J2Y25rdE16WXdTa3dLRVFqXzEtU1BrSUFNRWJpSFNMal9pNjlMRWpkQmJXRjZiMjRnZEc4Z2NHRjVJR1p5YjI1MGJHbHVaU0IzYjNKclpYSnpJQ1ExTURBZ2JXbHNiR2x2YmlCcGJpQmliMjUxYzJWektBQVAB?hl=en-US&gl=US&ceid=US%3Aen
 |https://news.google.com/stories/CAAqhQEICiJ_Q0JJU1dUb0pjM1J2Y25rdE16WXdTa3dLRVFqXzEtU1BrSUFNRWJpSFNMal9pNjlMRWpkQmJXRjZiMjRnZEc4Z2NHRjVJR1p5YjI1MGJHbHVaU0IzYjNKclpYSnpJQ1ExTURBZ2JXbHNiR2x2YmlCcGJpQmliMjUxYzJWektBQVAB?hl=en-US&gl=US&ceid=US%3Aen
"Actually you just got ROCKED by teens on TikTok who flooded the Trump 
campaign w/ fake ticket reservations & tricked you into believing a million 
people wanted your white supremacist open mic enough to pack an arena 
during COVID Shout out to Zoomers. Y’all make me so proud. ☺️"|https://news.google.com/stories/CAAqOQgKIjNDQklTSURvSmMzUnZjbmt0TXpZd1NoTUtFUWpUOHFDS2tJQU1FVkI1OFZoMG1WdFRLQUFQAQ?hl=en-US&gl=US&ceid=US%3Aen
"Campaign confirms the outdoor remarks have been cancelled. Statement per 
pooler @jdawsey1 "|https://news.google.com/stories/CAAqOQgKIjNDQklTSURvSmMzUnZjbmt0TXpZd1NoTUtFUWpUOHFDS2tJQU1FVkI1OFZoMG1WdFRLQUFQAQ?hl=en-US&gl=US&ceid=US%3Aen
"Surprise, surprise: Trump shares video as of his Mexican ‘rapists’ remarks, 
and video of Tulsa rally in which he told a fictional story of a ""tough 
hombre"" breaking in to a young woman's home, earns himself a Twitch ban. 
"|https://news.google.com/stories/CAAqOQgKIjNDQklTSURvSmMzUnZjbmt0TXpZd1NoTUtFUWpUOHFDS2tJQU1FVkI1OFZoMG1WdFRLQUFQAQ?hl=en-US&gl=US&ceid=US%3Aen
"From @realDonaldTrump Tulsa rally. Campaign employees REMOVED stickers 
saying ""do not sit here"" to help create social distancing. Only 6,000 
people showed up, but they didn't know that at this time. They wanted ALL 
the seats filled. They DIDN'T CARE who got sick. #ResignTrump 
"|https://news.google.com/stories/CAAqOQgKIjNDQklTSURvSmMzUnZjbmt0TXpZd1NoTUtFUWpUOHFDS2tJQU1FVkI1OFZoMG1WdFRLQUFQAQ?hl=en-US&gl=US&ceid=US%3Aen
"Today the President shared a video of people shouting “white power” and 
said they were “great.” Just like he did after Charlottesville. We’re in a 
battle for the soul of the nation — and the President has picked a side. 
But make no mistake: it’s a battle we will win."|https://news.google.com/stories/CAAqOQgKIjNDQklTSURvSmMzUnZjbmt0TXpZd1NoTUtFUWp3by1pUGtJQU1FVVBDX3VZZ0pJVU5LQUFQAQ?hl=en-US&gl=US&ceid=US%3Aen
"And a cleanup statement from White House spokesman Judd Deere: “President 
Trump is a big fan of The Villages. He did not hear the one statement made 
on the video. What he did see was tremendous enthusiasm from his many 
supporters.”"|https://news.google.com/stories/CAAqOQgKIjNDQklTSURvSmMzUnZjbmt0TXpZd1NoTUtFUWp3by1pUGtJQU1FVVBDX3VZZ0pJVU5LQUFQAQ?hl=en-US&gl=US&ceid=US%3Aen
"“I’ve not seen that video or that tweet, but obviously neither the 
President, his administration... would do anything to be supportive of 
white supremacy,” HHS Sec. Alex Azar reacts to a video Pres. Trump shared 
of a man with Trump campaign posters chanting ""white power"" #CNNSOTU 
"|https://news.google.com/stories/CAAqOQgKIjNDQklTSURvSmMzUnZjbmt0TXpZd1NoTUtFUWp3by1pUGtJQU1FVVBDX3VZZ0pJVU5LQUFQAQ?hl=en-US&gl=US&ceid=US%3Aen
"So Trump just retweeted and thanked a guy who was golfing and shouting 
white power in the Villages. This comes after he spent last night targeting 
black protesters with his twitter. He’s a white supremacist and he needs to 
go to prison. #TraitorTrump "|https://news.google.com/stories/CAAqOQgKIjNDQklTSURvSmMzUnZjbmt0TXpZd1NoTUtFUWp3by1pUGtJQU1FVVBDX3VZZ0pJVU5LQUFQAQ?hl=en-US&gl=US&ceid=US%3Aen
"Senator @CoryGardner from Colorado is a GREAT Senator who always fights for 
the people of his state. He protects your #2A, loves our Vets and Military, 
and cares deeply about our BEAUTIFUL public lands. Cory has my Complete and 
Total Endorsement! #COSEN "|https://news.google.com/stories/CAAqOQgKIjNDQklTSURvSmMzUnZjbmt0TXpZd1NoTUtFUWlZNU9DUWtJQU1FUjBrWG42YU5lWGJLQUFQAQ?hl=en-US&gl=US&ceid=US%3Aen
"Congressman @ScottRTipton is a great supporter of the #MAGA Agenda! He 
fights for your #2A rights and the Border Wall. Scott is working hard for 
Colorado and has my Complete and Total Endorsement! #CO03 
"|https://news.google.com/stories/CAAqOQgKIjNDQklTSURvSmMzUnZjbmt0TXpZd1NoTUtFUWlZNU9DUWtJQU1FUjBrWG42YU5lWGJLQUFQAQ?hl=en-US&gl=US&ceid=US%3Aen
"🚨BREAKING: the WH knew in early 2019 of intel that #Russia🇷🇺was offering 
bounties to KILL AMERICAN TROOPS, a *full year earlier* than reported. John 
Bolton told colleagues he *briefed @realDonaldTrump* on the intel 
assessment. #TrumpKnew #TrumpTraitor "|https://news.google.com/stories/CAAqOQgKIjNDQklTSURvSmMzUnZjbmt0TXpZd1NoTUtFUWlZNU9DUWtJQU1FUjBrWG42YU5lWGJLQUFQAQ?hl=en-US&gl=US&ceid=US%3Aen
"Honestly though, didn't take Carl Bernstein or McMaster, Tillerson, Bolton, 
Mattis, or Kelly for most of America to realize Trump is 'delusional' and a 
danger to national security. "|https://news.google.com/stories/CAAqOQgKIjNDQklTSURvSmMzUnZjbmt0TXpZd1NoTUtFUWlZNU9DUWtJQU1FUjBrWG42YU5lWGJLQUFQAQ?hl=en-US&gl=US&ceid=US%3Aen
 |https://news.google.com/stories/CAAqOQgKIjNDQklTSURvSmMzUnZjbmt0TXpZd1NoTUtFUWlZNU9DUWtJQU1FUjBrWG42YU5lWGJLQUFQAQ?hl=en-US&gl=US&ceid=US%3Aen
"This is a photo of the suspect vehicle referenced by Assistant Chief Kee. 
If you have information regarding this vehicle or its occupants, call JSO 
at 904-630-0500 or call Crime Stoppers at 1-866-845-TIPS. 
"|https://news.google.com/stories/CAAqOQgKIjNDQklTSURvSmMzUnZjbmt0TXpZd1NoTUtFUWlCbFl5UWtJQU1FZFdXemlfYXM5eW1LQUFQAQ?hl=en-US&gl=US&ceid=US%3Aen
"#JSO has responded to a reported shooting in the 12900 block of Pecan Park 
Road In the area of the Amazon facility. We are working to gather more 
information. Follow us for further. "|https://news.google.com/stories/CAAqOQgKIjNDQklTSURvSmMzUnZjbmt0TXpZd1NoTUtFUWlCbFl5UWtJQU1FZFdXemlfYXM5eW1LQUFQAQ?hl=en-US&gl=US&ceid=US%3Aen
"on the Jacksonville shooting that left one dead and two wounded today: ""a 
20-year-old black male victim was standing outside of the Amazon 
fulfillment center ... he was in line for a job application with about six 
others"" "|https://news.google.com/stories/CAAqOQgKIjNDQklTSURvSmMzUnZjbmt0TXpZd1NoTUtFUWlCbFl5UWtJQU1FZFdXemlfYXM5eW1LQUFQAQ?hl=en-US&gl=US&ceid=US%3Aen
"“It was very scary because it could’ve easily been me.” Witness who says 
she was feet from gunman describes deadly triple shooting at Jacksonville 
Amazon fulfillment center. It’s live at 10 on ⁦@ActionNewsJax⁩. 
"|https://news.google.com/stories/CAAqOQgKIjNDQklTSURvSmMzUnZjbmt0TXpZd1NoTUtFUWlCbFl5UWtJQU1FZFdXemlfYXM5eW1LQUFQAQ?hl=en-US&gl=US&ceid=US%3Aen
"BREAKING: One dead, two others shot at the Applebee’s in St. John in North 
County. @KMOV had a crew on the way and is working on additional details. 
"|https://news.google.com/stories/CAAqOQgKIjNDQklTSURvSmMzUnZjbmt0TXpZd1NoTUtFUWp2bEpPUGtJQU1FU05STWVtUDU0WHNLQUFQAQ?hl=en-US&gl=US&ceid=US%3Aen
"Amazon looks to self-driving future by acquiring Zoox (from @AP) ⁦@zoox⁩ 
⁦@amazon⁩ "|https://news.google.com/stories/CAAqWAgKIlJDQklTTnpvSmMzUnZjbmt0TXpZd1Npb0tFUWpZX0lTUWtJQU1FVWF4dmxCSVZJMXRFaFZCYldGNmIyNGdkRzhnWW5WNUlGcHZiM2dnTVdJb0FBUAE?hl=en-US&gl=US&ceid=US%3Aen
"Amazon just bought ⁦@zoox⁩ — you might want to listen to the Recode Decode 
I did with Aicha Evans and Jesse Levinson on the company a few months ago. 
IMHO: The product I saw in Silicon Valley would make a great autonomous 
delivery vehicle. "|https://news.google.com/stories/CAAqWAgKIlJDQklTTnpvSmMzUnZjbmt0TXpZd1Npb0tFUWpZX0lTUWtJQU1FVWF4dmxCSVZJMXRFaFZCYldGNmIyNGdkRzhnWW5WNUlGcHZiM2dnTVdJb0FBUAE?hl=en-US&gl=US&ceid=US%3Aen
"Amazon has agreed to pay more than $1 billion to buy autonomous-car 
developer Zoox, the e-commerce company's biggest bet yet on self-driving 
technology. "|https://news.google.com/stories/CAAqWAgKIlJDQklTTnpvSmMzUnZjbmt0TXpZd1Npb0tFUWpZX0lTUWtJQU1FVWF4dmxCSVZJMXRFaFZCYldGNmIyNGdkRzhnWW5WNUlGcHZiM2dnTVdJb0FBUAE?hl=en-US&gl=US&ceid=US%3Aen
""" $AMZN #Amazon confirms it is acquiring Zoox to help bring their vision of 
autonomous ride-hailing to reality "" Amazon should be banned from buying 
anything for 10 years. They are the ultimate destroyer of jobs and lives."|https://news.google.com/stories/CAAqWAgKIlJDQklTTnpvSmMzUnZjbmt0TXpZd1Npb0tFUWpZX0lTUWtJQU1FVWF4dmxCSVZJMXRFaFZCYldGNmIyNGdkRzhnWW5WNUlGcHZiM2dnTVdJb0FBUAE?hl=en-US&gl=US&ceid=US%3Aen
"Breaking: Twitch has suspended (not banned) Donald Trump's account for 
hateful conduct"|https://news.google.com/stories/CAAqcAgKImpDQklTU1RvSmMzUnZjbmt0TXpZd1Nqd0tFUWlWcUlPUWtJQU1FUXZZRFRzcUVvQ1dFaWRVZDJsMFkyZ2dkR1Z0Y0c5eVlYSnBiSGtnWW1GdWN5QlFjbVZ6YVdSbGJuUWdWSEoxYlhBb0FBUAE?hl=en-US&gl=US&ceid=US%3Aen
"Twitch has provided the following statement: ""Hateful conduct is not 
allowed on Twitch. In line with our policies, President Trump’s channel has 
been issued a temporary suspension from Twitch for comments made on stream"""|https://news.google.com/stories/CAAqcAgKImpDQklTU1RvSmMzUnZjbmt0TXpZd1Nqd0tFUWlWcUlPUWtJQU1FUXZZRFRzcUVvQ1dFaWRVZDJsMFkyZ2dkR1Z0Y0c5eVlYSnBiSGtnWW1GdWN5QlFjbVZ6YVdSbGJuUWdWSEoxYlhBb0FBUAE?hl=en-US&gl=US&ceid=US%3Aen
"❌ Twitch Partner ""DonaldTrump"" (@TeamTrump) has been banned! ❌ 
"|https://news.google.com/stories/CAAqcAgKImpDQklTU1RvSmMzUnZjbmt0TXpZd1Nqd0tFUWlWcUlPUWtJQU1FUXZZRFRzcUVvQ1dFaWRVZDJsMFkyZ2dkR1Z0Y0c5eVlYSnBiSGtnWW1GdWN5QlFjbVZ6YVdSbGJuUWdWSEoxYlhBb0FBUAE?hl=en-US&gl=US&ceid=US%3Aen
" #twitch #ban #firstban #partner #twitchpartner 
👮🏾‍♀️"|https://news.google.com/stories/CAAqcAgKImpDQklTU1RvSmMzUnZjbmt0TXpZd1Nqd0tFUWlWcUlPUWtJQU1FUXZZRFRzcUVvQ1dFaWRVZDJsMFkyZ2dkR1Z0Y0c5eVlYSnBiSGtnWW1GdWN5QlFjbVZ6YVdSbGJuUWdWSEoxYlhBb0FBUAE?hl=en-US&gl=US&ceid=US%3Aen
"News incoming: Reddit has banned hundreds of subreddits, including 
r/the_donald and r/chapotraphouse. The_donald has been dormant for months. 
Its moderators redirected users to a hyperactive Reddit clone with lax 
moderation called TheDonald dot win."|https://news.google.com/stories/CAAqcAgKImpDQklTU1RvSmMzUnZjbmt0TXpZd1Nqd0tFUWlWcUlPUWtJQU1FUXZZRFRzcUVvQ1dFaWRVZDJsMFkyZ2dkR1Z0Y0c5eVlYSnBiSGtnWW1GdWN5QlFjbVZ6YVdSbGJuUWdWSEoxYlhBb0FBUAE?hl=en-US&gl=US&ceid=US%3Aen
.@JeffBezos is a copy 🐈 haha|https://news.google.com/stories/CAAqOQgKIjNDQklTSURvSmMzUnZjbmt0TXpZd1NoTUtFUWpoaU9xTmtJQU1FVXFURUFaa3E0U0RLQUFQAQ?hl=en-US&gl=US&ceid=US%3Aen
Great Model Y review by @jayleno |https://news.google.com/stories/CAAqOQgKIjNDQklTSURvSmMzUnZjbmt0TXpZd1NoTUtFUWpoaU9xTmtJQU1FVXFURUFaa3E0U0RLQUFQAQ?hl=en-US&gl=US&ceid=US%3Aen
"🇺🇸 #Tesla Shares Top $1,000 Again on Musk’s Break-Even Optimism - 
Bloomberg *Link: "|https://news.google.com/stories/CAAqOQgKIjNDQklTSURvSmMzUnZjbmt0TXpZd1NoTUtFUWpoaU9xTmtJQU1FVXFURUFaa3E0U0RLQUFQAQ?hl=en-US&gl=US&ceid=US%3Aen
 |https://news.google.com/stories/CAAqOQgKIjNDQklTSURvSmMzUnZjbmt0TXpZd1NoTUtFUWpoaU9xTmtJQU1FVXFURUFaa3E0U0RLQUFQAQ?hl=en-US&gl=US&ceid=US%3Aen
"First road trip in the #teslamodelY - it handles like a 911 with twice the 
size and half the cost. I love the car. Tesla might have made the perfect 
vehicle... #tesla - in line up for delivery in MDR. $tsla @elonmusk 
"|https://news.google.com/stories/CAAqOQgKIjNDQklTSURvSmMzUnZjbmt0TXpZd1NoTUtFUWpoaU9xTmtJQU1FVXFURUFaa3E0U0RLQUFQAQ?hl=en-US&gl=US&ceid=US%3Aen
.@JeffBezos is a copy 🐈 haha|https://news.google.com/stories/CAAqdQgKIm9DQklTVFRvSmMzUnZjbmt0TXpZd1NrQUtFUWpIa2MtTWtJQU1FVDhkSDJ5SGR5TjJFaXRCYldGNmIyNGdkRzhnWVdOeGRXbHlaU0J6Wld4bUxXUnlhWFpwYm1jZ2MzUmhjblIxY0NCYWIyOTRLQUFQAQ?hl=en-US&gl=US&ceid=US%3Aen
"Amazon looks to self-driving future by acquiring Zoox (from @AP) ⁦@zoox⁩ 
⁦@amazon⁩ "|https://news.google.com/stories/CAAqdQgKIm9DQklTVFRvSmMzUnZjbmt0TXpZd1NrQUtFUWpIa2MtTWtJQU1FVDhkSDJ5SGR5TjJFaXRCYldGNmIyNGdkRzhnWVdOeGRXbHlaU0J6Wld4bUxXUnlhWFpwYm1jZ2MzUmhjblIxY0NCYWIyOTRLQUFQAQ?hl=en-US&gl=US&ceid=US%3Aen
"Amazon Buys Self-Driving Company Zoox For $1.2B And May Rule The World via 
@forbes "|https://news.google.com/stories/CAAqdQgKIm9DQklTVFRvSmMzUnZjbmt0TXpZd1NrQUtFUWpIa2MtTWtJQU1FVDhkSDJ5SGR5TjJFaXRCYldGNmIyNGdkRzhnWVdOeGRXbHlaU0J6Wld4bUxXUnlhWFpwYm1jZ2MzUmhjblIxY0NCYWIyOTRLQUFQAQ?hl=en-US&gl=US&ceid=US%3Aen
"Amazon just bought ⁦@zoox⁩ — you might want to listen to the Recode Decode 
I did with Aicha Evans and Jesse Levinson on the company a few months ago. 
IMHO: The product I saw in Silicon Valley would make a great autonomous 
delivery vehicle. "|https://news.google.com/stories/CAAqdQgKIm9DQklTVFRvSmMzUnZjbmt0TXpZd1NrQUtFUWpIa2MtTWtJQU1FVDhkSDJ5SGR5TjJFaXRCYldGNmIyNGdkRzhnWVdOeGRXbHlaU0J6Wld4bUxXUnlhWFpwYm1jZ2MzUmhjblIxY0NCYWIyOTRLQUFQAQ?hl=en-US&gl=US&ceid=US%3Aen
"We will pause all paid advertising on Facebook and Instagram in the US in 
support of the #StopHateForProfit campaign. Facebook, Inc. must take the 
clear and unequivocal actions to stop its platform from being used to 
spread and amplify racism and hate. >>>"|https://news.google.com/stories/CAAqfggKInhDQklTVkRvSmMzUnZjbmt0TXpZd1NrY0tFUWpDc2VTTGtJQU1FUkNtbG5Za0MwOWtFakpCYldWeWFXTmhiaUJpY21GdVpITWdhbTlwYmlCaWIzbGpiM1IwSUVaaFkyVmliMjlySUdGa2N5QmpZVzF3WVdsbmJpZ0FQAQ?hl=en-US&gl=US&ceid=US%3Aen
" 
"|https://news.google.com/stories/CAAqfggKInhDQklTVkRvSmMzUnZjbmt0TXpZd1NrY0tFUWpDc2VTTGtJQU1FUkNtbG5Za0MwOWtFakpCYldWeWFXTmhiaUJpY21GdVpITWdhbTlwYmlCaWIzbGpiM1IwSUVaaFkyVmliMjlySUdGa2N5QmpZVzF3WVdsbmJpZ0FQAQ?hl=en-US&gl=US&ceid=US%3Aen
"Patagonia is proud to join the Stop Hate for Profit campaign. We will pull 
all ads on Facebook and Instagram, effective immediately, through at least 
the end of July, pending meaningful action from the social media giant."|https://news.google.com/stories/CAAqfggKInhDQklTVkRvSmMzUnZjbmt0TXpZd1NrY0tFUWpDc2VTTGtJQU1FUkNtbG5Za0MwOWtFakpCYldWeWFXTmhiaUJpY21GdVpITWdhbTlwYmlCaWIzbGpiM1IwSUVaaFkyVmliMjlySUdGa2N5QmpZVzF3WVdsbmJpZ0FQAQ?hl=en-US&gl=US&ceid=US%3Aen
"We’re in. We’re Out @Facebook #StopHateForProfit Learn more: 
"|https://news.google.com/stories/CAAqfggKInhDQklTVkRvSmMzUnZjbmt0TXpZd1NrY0tFUWpDc2VTTGtJQU1FUkNtbG5Za0MwOWtFakpCYldWeWFXTmhiaUJpY21GdVpITWdhbTlwYmlCaWIzbGpiM1IwSUVaaFkyVmliMjlySUdGa2N5QmpZVzF3WVdsbmJpZ0FQAQ?hl=en-US&gl=US&ceid=US%3Aen
Diageo statement on social media advertising pause. |https://news.google.com/stories/CAAqfggKInhDQklTVkRvSmMzUnZjbmt0TXpZd1NrY0tFUWpDc2VTTGtJQU1FUkNtbG5Za0MwOWtFakpCYldWeWFXTmhiaUJpY21GdVpITWdhbTlwYmlCaWIzbGpiM1IwSUVaaFkyVmliMjlySUdGa2N5QmpZVzF3WVdsbmJpZ0FQAQ?hl=en-US&gl=US&ceid=US%3Aen
"ESM Goh Chok Tong is a firm believer in political renewal. Successive 
generations have brought us here today. Now we must look to the next 
generation to shape our future. – LHL "|https://news.google.com/stories/CAAqOQgKIjNDQklTSURvSmMzUnZjbmt0TXpZd1NoTUtFUWpYckxLS2tJQU1FUnhsTHRRM2dsMGJLQUFQAQ?hl=en-US&gl=US&ceid=US%3Aen
"As said earlier, Progress Singapore Party has filed nomination papers for 
Michael Chua, Terence Soon, Harish Pillay, Abas Kasmani and Wendy Low to 
contest Tanjong Pagar. This puts an end to the Lee Hsien Yang saga #GE2020 
"|https://news.google.com/stories/CAAqOQgKIjNDQklTSURvSmMzUnZjbmt0TXpZd1NoTUtFUWpYckxLS2tJQU1FUnhsTHRRM2dsMGJLQUFQAQ?hl=en-US&gl=US&ceid=US%3Aen
"Speaking to the virtual #GlobalGoalUnite Summit by @GlblCtzn, I emphasised 
the importance of vaccine multilateralism in our common fight against 
COVID-19. Singapore looks forward to working with the @EU_Commission & 
like-minded parties on this. – LHL "|https://news.google.com/stories/CAAqOQgKIjNDQklTSURvSmMzUnZjbmt0TXpZd1NoTUtFUWpYckxLS2tJQU1FUnhsTHRRM2dsMGJLQUFQAQ?hl=en-US&gl=US&ceid=US%3Aen
"It was announced this morning that @leehsienloong's brother Lee Hsien Yang 
has joined the opposition Progress Singapore Party. Now, he's featured in a 
PSP video saying the PAP has lost its way, and that it's possible to love 
Singapore but not vote for the ruling party. #GE2020 "|https://news.google.com/stories/CAAqOQgKIjNDQklTSURvSmMzUnZjbmt0TXpZd1NoTUtFUWpYckxLS2tJQU1FUnhsTHRRM2dsMGJLQUFQAQ?hl=en-US&gl=US&ceid=US%3Aen
"""Amazon’s live streaming video site #Twitch temporarily banned President 
Donald Trump from its platform Monday, citing 'hateful conduct' in his 
posts. It’s unclear how long Trump’s channel will be suspended."" 
"|https://news.google.com/stories/CAAqaAgKImJDQklTUXpvSmMzUnZjbmt0TXpZd1NqWUtFUWlHcnRHT2tJQU1FZS14c29IZ1FVTDJFaUZCYldGNmIyNGdTVzVrYVdFZ2RHOGdhR2x5WlNBeU1Dd3dNREFnYzNSaFptWW9BQVAB?hl=en-US&gl=US&ceid=US%3Aen
"New: President Donald Trump has been temporarily suspended from @Twitch, 
the Amazon-owned streaming platform, for ""hateful"" comments made on stream. 
The offending content came from the recent Tulsa rally and a rebroadcast of 
a 2016 rally. @Adweek story TK"|https://news.google.com/stories/CAAqaAgKImJDQklTUXpvSmMzUnZjbmt0TXpZd1NqWUtFUWlHcnRHT2tJQU1FZS14c29IZ1FVTDJFaUZCYldGNmIyNGdTVzVrYVdFZ2RHOGdhR2x5WlNBeU1Dd3dNREFnYzNSaFptWW9BQVAB?hl=en-US&gl=US&ceid=US%3Aen
"“It was very scary because it could’ve easily been me.” Witness who says 
she was feet from gunman describes deadly triple shooting at Jacksonville 
Amazon fulfillment center. It’s live at 10 on ⁦@ActionNewsJax⁩. 
"|https://news.google.com/stories/CAAqfAgKInZDQklTVWpvSmMzUnZjbmt0TXpZd1NrVUtFUWpyMjZTT2tJQU1FZjBIWHdXT3BOZkRFakF5SUdSbFlXUXNJRFFnYVc1cWRYSmxaQ0JwYmlCRFlXeHBabTl5Ym1saElGZGhiRzFoY25RZ2MyaHZiM1JwYm1jb0FBUAE?hl=en-US&gl=US&ceid=US%3Aen
"""At least six people were injured, two of whom died, in a shooting Saturday 
afternoon at the Walmart Distribution Center"" - Did this even make the 
news?!? #gunviolence "|https://news.google.com/stories/CAAqfAgKInZDQklTVWpvSmMzUnZjbmt0TXpZd1NrVUtFUWpyMjZTT2tJQU1FZjBIWHdXT3BOZkRFakF5SUdSbFlXUXNJRFFnYVc1cWRYSmxaQ0JwYmlCRFlXeHBabTl5Ym1saElGZGhiRzFoY25RZ2MyaHZiM1JwYm1jb0FBUAE?hl=en-US&gl=US&ceid=US%3Aen
"#Update to a story we first brought you last night at 10 -- investigators 
say the man who drove into a Walmart Distribution Center and started 
shooting was fired from his job at that center in Red Bluff last year. 
Louis Lane was shot and killed by police in the parking lot @FOX40 
"|https://news.google.com/stories/CAAqfAgKInZDQklTVWpvSmMzUnZjbmt0TXpZd1NrVUtFUWpyMjZTT2tJQU1FZjBIWHdXT3BOZkRFakF5SUdSbFlXUXNJRFFnYVc1cWRYSmxaQ0JwYmlCRFlXeHBabTl5Ym1saElGZGhiRzFoY25RZ2MyaHZiM1JwYm1jb0FBUAE?hl=en-US&gl=US&ceid=US%3Aen
"Two dead, 4 injured after shooting at Walmart distribution center in Red 
Bluff "|https://news.google.com/stories/CAAqfAgKInZDQklTVWpvSmMzUnZjbmt0TXpZd1NrVUtFUWpyMjZTT2tJQU1FZjBIWHdXT3BOZkRFakF5SUdSbFlXUXNJRFFnYVc1cWRYSmxaQ0JwYmlCRFlXeHBabTl5Ym1saElGZGhiRzFoY25RZ2MyaHZiM1JwYm1jb0FBUAE?hl=en-US&gl=US&ceid=US%3Aen
"Another major boost for Western Sydney with @amazon setting up a huge 
distribution centre in Kemps Creek, creating thousands of jobs. 
"|https://news.google.com/stories/CAAqgAEICiJ6Q0JJU1ZUb0pjM1J2Y25rdE16WXdTa2dLRVFpWTFyQ1FrSUFNRWI4Sm01T1ZQN09lRWpOQmJXRjZiMjRnZEc4Z2IzQmxiaUJ5YjJKdmRHbGpjeUJtZFd4bWFXeHRaVzUwSUdObGJuUnlaU0JwYmlCVGVXUnVaWGtvQUFQAQ?hl=en-US&gl=US&ceid=US%3Aen
"Amazon backs Sydney for high-tech expansion @GladysB @stuartayresmp #NSWpol 
#Auspol "|https://news.google.com/stories/CAAqgAEICiJ6Q0JJU1ZUb0pjM1J2Y25rdE16WXdTa2dLRVFpWTFyQ1FrSUFNRWI4Sm01T1ZQN09lRWpOQmJXRjZiMjRnZEc4Z2IzQmxiaUJ5YjJKdmRHbGpjeUJtZFd4bWFXeHRaVzUwSUdObGJuUnlaU0JwYmlCVGVXUnVaWGtvQUFQAQ?hl=en-US&gl=US&ceid=US%3Aen
"The NSW and Federal Governments will invest $1bn into shovel ready 
infrastructure projects & road upgrades to help kick-start the economy as 
we recover from COVID-19. The fast tracking of these projects will create 
thousands of jobs right now, when we need them most. "|https://news.google.com/stories/CAAqgAEICiJ6Q0JJU1ZUb0pjM1J2Y25rdE16WXdTa2dLRVFpWTFyQ1FrSUFNRWI4Sm01T1ZQN09lRWpOQmJXRjZiMjRnZEc4Z2IzQmxiaUJ5YjJKdmRHbGpjeUJtZFd4bWFXeHRaVzUwSUdObGJuUnlaU0JwYmlCVGVXUnVaWGtvQUFQAQ?hl=en-US&gl=US&ceid=US%3Aen
"In 1988 the Sydney Powerhouse Museum won the prestigious architectural 
prize, the Sir John Sulman Medal. That all seems to be forgotten now in the 
haste to close it. @GladysB it's not too late to change your mind. It makes 
economic sense to keep the Ultimo location."|https://news.google.com/stories/CAAqgAEICiJ6Q0JJU1ZUb0pjM1J2Y25rdE16WXdTa2dLRVFpWTFyQ1FrSUFNRWI4Sm01T1ZQN09lRWpOQmJXRjZiMjRnZEc4Z2IzQmxiaUJ5YjJKdmRHbGpjeUJtZFd4bWFXeHRaVzUwSUdObGJuUnlaU0JwYmlCVGVXUnVaWGtvQUFQAQ?hl=en-US&gl=US&ceid=US%3Aen
"OTD in 2007, the #iPhone debuted. It transformed not just the wireless 
world, but the way we think of the Internet. I happened to be staying near 
SF's Union Square @Apple store that day, and was struck by the line. Looks 
like they were on to something! 📱"|https://news.google.com/stories/CAAqOQgKIjNDQklTSURvSmMzUnZjbmt0TXpZd1NoTUtFUWpCeHVXampvQU1FZmo4OE9fdWVzeFRLQUFQAQ?hl=en-US&gl=US&ceid=US%3Aen
" 
"|https://news.google.com/stories/CAAqOQgKIjNDQklTSURvSmMzUnZjbmt0TXpZd1NoTUtFUWpCeHVXampvQU1FZmo4OE9fdWVzeFRLQUFQAQ?hl=en-US&gl=US&ceid=US%3Aen
back on hold.... @AppleSupport |https://news.google.com/stories/CAAqOQgKIjNDQklTSURvSmMzUnZjbmt0TXpZd1NoTUtFUWpCeHVXampvQU1FZmo4OE9fdWVzeFRLQUFQAQ?hl=en-US&gl=US&ceid=US%3Aen
"The Fed disclosed its index of nearly 800 companies that essentially 
comprises a snapshot used to guide the central bank's corporate debt 
purchases. On the list: giants like @Apple @Verizon @Microsoft, plus US 
subsidiaries of foreign carmakers "|https://news.google.com/stories/CAAqOQgKIjNDQklTSURvSmMzUnZjbmt0TXpZd1NoTUtFUWpCeHVXampvQU1FZmo4OE9fdWVzeFRLQUFQAQ?hl=en-US&gl=US&ceid=US%3Aen
