tweet|covering_link
"Patriots, the ruling on Flynn was as unexpected as it was immoral. But it 
should tell us that we have to defeat @realDonaldTrump, replace Bill Barr 
and prosecute them both. Should @GenFlynn survive this there is plenty more 
on which he can be prosecuted."|https://news.google.com/stories/CAAqOQgKIjNDQklTSURvSmMzUnZjbmt0TXpZd1NoTUtFUWlqZ0tPSWtJQU1FVXZpWHFlamVmdzlLQUFQAQ?hl=en-US&gl=US&ceid=US%3Aen
"Alibaba $BABA and $JD handle record $136.51bln in sales during major #China 
shopping event. Known as 618 because it falls on June 18, the festival was 
being closely watched as a gauge of health for the Chinese consumer amid 
the pandemic. "|https://news.google.com/stories/CAAqOQgKIjNDQklTSURvSmMzUnZjbmt0TXpZd1NoTUtFUWotX09LR2tJQU1FWWsyRVdZV3V0V29LQUFQAQ?hl=en-US&gl=US&ceid=US%3Aen
"A study begins this summer on an inhalable form of #remdesivir, a promising 
#COVID19 drug made by @GileadSciences. Infectious disease experts say it 
could be the treatment breakthrough the world has been waiting for. 
"|https://news.google.com/stories/CAAqOQgKIjNDQklTSURvSmMzUnZjbmt0TXpZd1NoTUtFUWkwNHFIUmo0QU1FZEFBWGtvVFBRWm5LQUFQAQ?hl=en-US&gl=US&ceid=US%3Aen
"(Reuters) - Gilead Sciences Inc said on Monday it expects to be able to 
supply enough of its antiviral drug remdesivir by year end to treat more 
than 2 million COVID-19 patients, more than double its previous target of 1 
million. $GILD ⁦@LiveSquawk⁩ "|https://news.google.com/stories/CAAqOQgKIjNDQklTSURvSmMzUnZjbmt0TXpZd1NoTUtFUWkwNHFIUmo0QU1FZEFBWGtvVFBRWm5LQUFQAQ?hl=en-US&gl=US&ceid=US%3Aen
"$GILD is about to start clinical trials for an inhaled version of 
Remdesivir. This would make drug much more accessible IF still safe & 
effective. "|https://news.google.com/stories/CAAqOQgKIjNDQklTSURvSmMzUnZjbmt0TXpZd1NoTUtFUWkwNHFIUmo0QU1FZEFBWGtvVFBRWm5LQUFQAQ?hl=en-US&gl=US&ceid=US%3Aen
"Cipla gets regulator's nod to make generic verison of Gilead's COVID-19 
drug remdesivir @archanajsr reports @Cipla_Global #Covid_19 #Pharma 
@CNBCTV18Live "|https://news.google.com/stories/CAAqOQgKIjNDQklTSURvSmMzUnZjbmt0TXpZd1NoTUtFUWkwNHFIUmo0QU1FZEFBWGtvVFBRWm5LQUFQAQ?hl=en-US&gl=US&ceid=US%3Aen
"Wow. I'm literally stunned. Apple just doubled down on their rejection of 
HEY's ability to provide bug fixes and new features, unless we submit to 
their outrageous demand of 15-30% of our revenue. Even worse: We're told 
that unless we comply, they'll REMOVE THE APP."|https://news.google.com/stories/CAAqOQgKIjNDQklTSURvSmMzUnZjbmt0TXpZd1NoTUtFUWpnMzVhRmtJQU1FUzV3U09sT3JqbXdLQUFQAQ?hl=en-US&gl=US&ceid=US%3Aen
"For all the snark and exasperation, we're going to take @pschiller up on 
this offer: ""There are many things that they could do to make the app work 
within the rules that we have. We would love for them to do that"". We won't 
ever do IAP, but try some of the other ""many things""."|https://news.google.com/stories/CAAqOQgKIjNDQklTSURvSmMzUnZjbmt0TXpZd1NoTUtFUWpnMzVhRmtJQU1FUzV3U09sT3JqbXdLQUFQAQ?hl=en-US&gl=US&ceid=US%3Aen
"I just had an entire convo with an @Apple rep who totally failed even the 
basic Turing test. Me: Question Rep: Yes, here's an answer to a different 
question Me: But that's not my question Rep: Oh, okay, here's the same 
answer "|https://news.google.com/stories/CAAqOQgKIjNDQklTSURvSmMzUnZjbmt0TXpZd1NoTUtFUWpnMzVhRmtJQU1FUzV3U09sT3JqbXdLQUFQAQ?hl=en-US&gl=US&ceid=US%3Aen
"Apple screws around with App Store billing (2019 revenue: ~$15bn): all hell 
breaks looks Apple starts to dismantle half the online ad business…🦗"|https://news.google.com/stories/CAAqOQgKIjNDQklTSURvSmMzUnZjbmt0TXpZd1NoTUtFUWpnMzVhRmtJQU1FUzV3U09sT3JqbXdLQUFQAQ?hl=en-US&gl=US&ceid=US%3Aen
"I’m dusting off my lute and quill, I have some news, some mead to spill: 
After all the months we’ve been apart It’s time for production to restart. 
The Witcher and his bard – who’s flawless, Will reunite on set 17 August."|https://news.google.com/stories/CAAqOQgKIjNDQklTSURvSmMzUnZjbmt0TXpZd1NoTUtFUWllbHNhSWtJQU1FZW1DQWlYV3FEREZLQUFQAQ?hl=en-US&gl=US&ceid=US%3Aen
"#Netflix to start filming #HenryCavill starrer 'The Witcher' in August 
#GeoNews"|https://news.google.com/stories/CAAqOQgKIjNDQklTSURvSmMzUnZjbmt0TXpZd1NoTUtFUWllbHNhSWtJQU1FZW1DQWlYV3FEREZLQUFQAQ?hl=en-US&gl=US&ceid=US%3Aen
"I love my community and what we built together on Mixer. I have some 
decisions to make and will be thinking about you all as I make them."|https://news.google.com/stories/CAAqOQgKIjNDQklTSURvSmMzUnZjbmt0TXpZd1NoTUtFUWpVOHZLSGtJQU1FVE9kTGowenduajlLQUFQAQ?hl=en-US&gl=US&ceid=US%3Aen
"Sources: Facebook offered an insane offer at almost double for the original 
Mixer contracts of Ninja and Shroud but Loaded/Ninja/Shroud said no and 
forced Mixer to buy them out. Ninja made ~$30M from Mixer, and Shroud made 
~$10M Ninja and Shroud are now free agents"|https://news.google.com/stories/CAAqOQgKIjNDQklTSURvSmMzUnZjbmt0TXpZd1NoTUtFUWpVOHZLSGtJQU1FVE9kTGowenduajlLQUFQAQ?hl=en-US&gl=US&ceid=US%3Aen
"Mixer Partners, streamers, and community - today, we've got some very big 
news for you. While we’ve decided to close the operations side of Mixer, 
we're officially partnering with @FacebookGaming and we're cordially 
inviting all of you to join. 📰 "|https://news.google.com/stories/CAAqOQgKIjNDQklTSURvSmMzUnZjbmt0TXpZd1NoTUtFUWpVOHZLSGtJQU1FVE9kTGowenduajlLQUFQAQ?hl=en-US&gl=US&ceid=US%3Aen
" 
"|https://news.google.com/stories/CAAqOQgKIjNDQklTSURvSmMzUnZjbmt0TXpZd1NoTUtFUWpVOHZLSGtJQU1FVE9kTGowenduajlLQUFQAQ?hl=en-US&gl=US&ceid=US%3Aen
"Sources familiar with the deal have informed me that while Facebook did try 
and negotiate to keep their big partners both Shroud and Ninja opted out. 
They have received their full payments and as of midnight yesterday were 
free to engage in talks with other platforms. Game on."|https://news.google.com/stories/CAAqOQgKIjNDQklTSURvSmMzUnZjbmt0TXpZd1NoTUtFUWpVOHZLSGtJQU1FVE9kTGowenduajlLQUFQAQ?hl=en-US&gl=US&ceid=US%3Aen
"Bolton’s book, which is getting terrible reviews, is a compilation of lies 
and made up stories, all intended to make me look bad. Many of the 
ridiculous statements he attributes to me were never made, pure fiction. 
Just trying to get even for firing him like the sick puppy he is!"|https://news.google.com/stories/CAAqiwEICiKEAUNCSVNYVG9KYzNSdmNua3RNell3U2xBS0VRaWE4LTJCa0lBTUVWYjFpeUpmZ0tpVEVqdEtiMmh1SUVKdmJIUnZiaUJ5WlhabFlXeHpJR1JsZEdGcGJITWdiMllnVkhKMWJYQWdZV1J0YVc1cGMzUnlZWFJwYjI0Z2FXNGdZbTl2YXlnQVAB?hl=en-US&gl=US&ceid=US%3Aen
"Just in, a Bolton spokesperson on the Telegraph story: ""It is incorrect. He 
will not be voting for Joe Biden, nor will he be voting for Donald Trump."""|https://news.google.com/stories/CAAqiwEICiKEAUNCSVNYVG9KYzNSdmNua3RNell3U2xBS0VRaWE4LTJCa0lBTUVWYjFpeUpmZ0tpVEVqdEtiMmh1SUVKdmJIUnZiaUJ5WlhabFlXeHpJR1JsZEdGcGJITWdiMllnVkhKMWJYQWdZV1J0YVc1cGMzUnlZWFJwYjI0Z2FXNGdZbTl2YXlnQVAB?hl=en-US&gl=US&ceid=US%3Aen
"""Minds were made up on Capitol Hill."" John Bolton defends his decision not 
to testify during the impeachment trial, telling @martharaddatz, ""It would 
not have made a difference."" "|https://news.google.com/stories/CAAqiwEICiKEAUNCSVNYVG9KYzNSdmNua3RNell3U2xBS0VRaWE4LTJCa0lBTUVWYjFpeUpmZ0tpVEVqdEtiMmh1SUVKdmJIUnZiaUJ5WlhabFlXeHpJR1JsZEdGcGJITWdiMllnVkhKMWJYQWdZV1J0YVc1cGMzUnlZWFJwYjI0Z2FXNGdZbTl2YXlnQVAB?hl=en-US&gl=US&ceid=US%3Aen
 |https://news.google.com/stories/CAAqiwEICiKEAUNCSVNYVG9KYzNSdmNua3RNell3U2xBS0VRaWE4LTJCa0lBTUVWYjFpeUpmZ0tpVEVqdEtiMmh1SUVKdmJIUnZiaUJ5WlhabFlXeHpJR1JsZEdGcGJITWdiMllnVkhKMWJYQWdZV1J0YVc1cGMzUnlZWFJwYjI0Z2FXNGdZbTl2YXlnQVAB?hl=en-US&gl=US&ceid=US%3Aen
"Is James Comey and his band of Dirty Cops going to apologize to General 
Michael Flynn (and many others) for what they have done to ruin his life? 
What about Robert Mueller and his Angry Democrat Cronies - Are they going 
to say, SO SORRY? And what about Obama & Biden?"|https://news.google.com/stories/CAAqiwEICiKEAUNCSVNYVG9KYzNSdmNua3RNell3U2xBS0VRaWE4LTJCa0lBTUVWYjFpeUpmZ0tpVEVqdEtiMmh1SUVKdmJIUnZiaUJ5WlhabFlXeHpJR1JsZEdGcGJITWdiMllnVkhKMWJYQWdZV1J0YVc1cGMzUnlZWFJwYjI0Z2FXNGdZbTl2YXlnQVAB?hl=en-US&gl=US&ceid=US%3Aen
"It makes me SO happy to see a show like Love, Victor out there for today's 
queer youth (it's also just a really great teen soap without dead brother 
corpses or jingle jangle). I'm going to need SEASONS. Anyway, I adore this 
video we did with the cast "|https://news.google.com/stories/CAAqOQgKIjNDQklTSURvSmMzUnZjbmt0TXpZd1NoTUtFUWlBX3AtR2tJQU1FVGxsVHR6WldyZi1LQUFQAQ?hl=en-US&gl=US&ceid=US%3Aen
 |https://news.google.com/stories/CAAqOQgKIjNDQklTSURvSmMzUnZjbmt0TXpZd1NoTUtFUWlBX3AtR2tJQU1FVGxsVHR6WldyZi1LQUFQAQ?hl=en-US&gl=US&ceid=US%3Aen
"We just finished all four seasons of @thedurrellsITV on @PrimeVideo . We 
loved it. It's a charming, funny, relaxing, & enjoyable show with a damn 
good international cast. If you're looking for a new British show to binge 
and make you smile then jump on #TheDurrellsinCorfu train! 
"|https://news.google.com/stories/CAAqOQgKIjNDQklTSURvSmMzUnZjbmt0TXpZd1NoTUtFUWlBX3AtR2tJQU1FVGxsVHR6WldyZi1LQUFQAQ?hl=en-US&gl=US&ceid=US%3Aen
"Finally binged both seasons of #AfterLife on @Netflix. @RickyGervais is 
amazing in it. It's that rare show that makes you laugh as much as it makes 
you cry. Supporting cast is all awesome. Love his wife's home video 
messages. Love his relationship with his dog 🐶. Love the music. 
"|https://news.google.com/stories/CAAqOQgKIjNDQklTSURvSmMzUnZjbmt0TXpZd1NoTUtFUWlBX3AtR2tJQU1FVGxsVHR6WldyZi1LQUFQAQ?hl=en-US&gl=US&ceid=US%3Aen
"Jay Leno likes my new car, which I finally picked up on Friday. My review: 
amazing car, terrible delivery experience by @Tesla. I have a dual motor 
long-range with full autopilot. After driving it for over 200 miles so far, 
I have found no defects. "|https://news.google.com/stories/CAAqOQgKIjNDQklTSURvSmMzUnZjbmt0TXpZd1NoTUtFUWltbTh1SWtJQU1FWGIxM3J5b0oybHpLQUFQAQ?hl=en-US&gl=US&ceid=US%3Aen
"Tesla’s Model S is the first electric car with 400-mile range EPA rating 
"|https://news.google.com/stories/CAAqOQgKIjNDQklTSURvSmMzUnZjbmt0TXpZd1NoTUtFUWplekl5SGtJQU1FZVFSNURBSWVsZ3pLQUFQAQ?hl=en-US&gl=US&ceid=US%3Aen
"Tesla Model S now first ever electric vehicle to receive EPA range rating 
above 400 miles! "|https://news.google.com/stories/CAAqOQgKIjNDQklTSURvSmMzUnZjbmt0TXpZd1NoTUtFUWplekl5SGtJQU1FZVFSNURBSWVsZ3pLQUFQAQ?hl=en-US&gl=US&ceid=US%3Aen
"Today is going to be a two venti vanilla latte kind of day. #schoolPR 
@Starbucks "|https://news.google.com/stories/CAAqOQgKIjNDQklTSURvSmMzUnZjbmt0TXpZd1NoTUtFUWoxNE1UN2o0QU1FVUNVMWhDQ2Z3N2xLQUFQAQ?hl=en-US&gl=US&ceid=US%3Aen
"Thank you to the barista at @Starbucks in Fountain City for saying 
“yaaaaas!” When I ordered my drink in the drive thru. Made me chuckle 😂"|https://news.google.com/stories/CAAqOQgKIjNDQklTSURvSmMzUnZjbmt0TXpZd1NoTUtFUWoxNE1UN2o0QU1FVUNVMWhDQ2Z3N2xLQUFQAQ?hl=en-US&gl=US&ceid=US%3Aen
"Hey @Starbucks this is a great start but @ImpossibleFoods sausage = 
#whatveganseat and those of us on #vegan diet can't eat this. Maybe 
@eatjust option? THANK UU!! "|https://news.google.com/stories/CAAqOQgKIjNDQklTSURvSmMzUnZjbmt0TXpZd1NoTUtFUWoxNE1UN2o0QU1FVUNVMWhDQ2Z3N2xLQUFQAQ?hl=en-US&gl=US&ceid=US%3Aen
"On 1st day of mandatory masking by biz in Austin, got 1st report from 
constituent of local @Starbucks serving customer w/o mask tho required 
signage abt required masking on display. Barista said unable to enforce. 
#txlege 1/"|https://news.google.com/stories/CAAqOQgKIjNDQklTSURvSmMzUnZjbmt0TXpZd1NoTUtFUWoxNE1UN2o0QU1FVUNVMWhDQ2Z3N2xLQUFQAQ?hl=en-US&gl=US&ceid=US%3Aen
".@amazon is hosting its first-ever Big Style Sale this week with deals on 
all things fashion up to 50% off! I’m sharing more details including what 
you should hold off from buying today on the news at 3 & 4pm! @abc13houston"|https://news.google.com/stories/CAAqZQgKIl9DQklTUVRvSmMzUnZjbmt0TXpZd1NqUUtFUWprNzlhR2tJQU1FYmdTM3dQTm9oc2FFaDlCYldGNmIyNG5jeUJDYVdjZ1UzUjViR1VnVTJGc1pTQnBjeUJvWlhKbEtBQVAB?hl=en-US&gl=US&ceid=US%3Aen
"Axios: Shopify goes after Amazon with new Walmart deal. Another example of 
a very bad title for an article. No need to brag, you don't sell fresh 
fish, and we would be interested anyways. "|https://news.google.com/stories/CAAqZQgKIl9DQklTUVRvSmMzUnZjbmt0TXpZd1NqUUtFUWprNzlhR2tJQU1FYmdTM3dQTm9oc2FFaDlCYldGNmIyNG5jeUJDYVdjZ1UzUjViR1VnVTJGc1pTQnBjeUJvWlhKbEtBQVAB?hl=en-US&gl=US&ceid=US%3Aen
"Google’s U.S. ad revenue to fall this year for the first time since 
eMarketer began modeling it in 2008, the research firm says, citing 
pandemic-battered travel industry. By @keachhagey "|https://news.google.com/stories/CAAqOQgKIjNDQklTSURvSmMzUnZjbmt0TXpZd1NoTUtFUWoxenN5SWtJQU1FWWtRMDdVZnZlbGJLQUFQAQ?hl=en-US&gl=US&ceid=US%3Aen
"imagine being 16 and being groomed by a stand up comedian twice ur age and 
the only reason you never met up and never got physically m*lested was 
because u had just gotten a boyfriend ur own age "|https://news.google.com/stories/CAAqOQgKIjNDQklTSURvSmMzUnZjbmt0TXpZd1NoTUtFUWlHaTZLR2tJQU1FWmJrX1JyblQ5dHZLQUFQAQ?hl=en-US&gl=US&ceid=US%3Aen
imagine getting owned by a 16 year old |https://news.google.com/stories/CAAqOQgKIjNDQklTSURvSmMzUnZjbmt0TXpZd1NoTUtFUWlHaTZLR2tJQU1FWmJrX1JyblQ5dHZLQUFQAQ?hl=en-US&gl=US&ceid=US%3Aen
"Need a vocalist to sing a verse on a song. The lyrics are written, just 
need your performance to finish it all up 🎤 More info here: 
"|https://news.google.com/stories/CAAqOQgKIjNDQklTSURvSmMzUnZjbmt0TXpZd1NoTUtFUWpUNDZ5RmtJQU1FVnN4MDVqbjhxWURLQUFQAQ?hl=en-US&gl=US&ceid=US%3Aen
"Write a 6 word story about this photo of a woman going ""🤫"" Can be funny, 
sad, weird, sincere, mysterious... all up to you. :) Add your writing here: 
"|https://news.google.com/stories/CAAqOQgKIjNDQklTSURvSmMzUnZjbmt0TXpZd1NoTUtFUWpUNDZ5RmtJQU1FVnN4MDVqbjhxWURLQUFQAQ?hl=en-US&gl=US&ceid=US%3Aen
 |https://news.google.com/stories/CAAqOQgKIjNDQklTSURvSmMzUnZjbmt0TXpZd1NoTUtFUWpUNDZ5RmtJQU1FVnN4MDVqbjhxWURLQUFQAQ?hl=en-US&gl=US&ceid=US%3Aen
"7500, the new Joseph Gordon-Levitt movie available for streaming on Prime, 
is a claustrophobic hijacking thriller that cleverly builds and sustains 
tension with its unique decision to never leave the cockpit. Spoiler-free 
review for this week’s Long Shot. "|https://news.google.com/stories/CAAqOQgKIjNDQklTSURvSmMzUnZjbmt0TXpZd1NoTUtFUWpUNDZ5RmtJQU1FVnN4MDVqbjhxWURLQUFQAQ?hl=en-US&gl=US&ceid=US%3Aen
"Watching 7500 on #AmazonPrime with @hitRECordJoe - this thing will make you 
clinch squirt diamonds it's so intense... DYING - so intense"|https://news.google.com/stories/CAAqOQgKIjNDQklTSURvSmMzUnZjbmt0TXpZd1NoTUtFUWpUNDZ5RmtJQU1FVnN4MDVqbjhxWURLQUFQAQ?hl=en-US&gl=US&ceid=US%3Aen
"For all the snark and exasperation, we're going to take @pschiller up on 
this offer: ""There are many things that they could do to make the app work 
within the rules that we have. We would love for them to do that"". We won't 
ever do IAP, but try some of the other ""many things""."|https://news.google.com/stories/CAAqOQgKIjNDQklTSURvSmMzUnZjbmt0TXpZd1NoTUtFUWpGLXMySWtJQU1FY2JMWGc4RjRlMF9LQUFQAQ?hl=en-US&gl=US&ceid=US%3Aen
"Apple has approved HEY for iOS 1.0.2 without IAP!! We’ve submitted 1.0.3 
for final, definitive approval with a new free option and HEY for Work. SO 
NOW WE WAIT. CAN THIS STAND-OFF END IN A TRUCE? "|https://news.google.com/stories/CAAqOQgKIjNDQklTSURvSmMzUnZjbmt0TXpZd1NoTUtFUWpGLXMySWtJQU1FY2JMWGc4RjRlMF9LQUFQAQ?hl=en-US&gl=US&ceid=US%3Aen
"I just had an entire convo with an @Apple rep who totally failed even the 
basic Turing test. Me: Question Rep: Yes, here's an answer to a different 
question Me: But that's not my question Rep: Oh, okay, here's the same 
answer "|https://news.google.com/stories/CAAqOQgKIjNDQklTSURvSmMzUnZjbmt0TXpZd1NoTUtFUWpGLXMySWtJQU1FY2JMWGc4RjRlMF9LQUFQAQ?hl=en-US&gl=US&ceid=US%3Aen
"Apple screws around with App Store billing (2019 revenue: ~$15bn): all hell 
breaks looks Apple starts to dismantle half the online ad business…🦗"|https://news.google.com/stories/CAAqOQgKIjNDQklTSURvSmMzUnZjbmt0TXpZd1NoTUtFUWpGLXMySWtJQU1FY2JMWGc4RjRlMF9LQUFQAQ?hl=en-US&gl=US&ceid=US%3Aen
"iOS 14 has a new Back Tap feature in Accessibility and it's wild. You can 
perform quick actions by double- or triple-tapping the *back of your 
iPhone*. Literally quick taps on the back; works with a case on. These 
include system actions as well as custom shortcuts. "|https://news.google.com/stories/CAAqfQgKIndDQklTVXpvSmMzUnZjbmt0TXpZd1NrWUtFUWlFaE1tSWtJQU1FWW9FdkRrRy1DX0hFakZCY0hCc1pTZHpJRmR2Y214a2QybGtaU0JFWlhabGJHOXdaWEp6SUVOdmJtWmxjbVZ1WTJVZ2NISmxkbWxsZDJWa0tBQVAB?hl=en-US&gl=US&ceid=US%3Aen
"iOS 14 comes with support for Sound Recognition in Accessibility. Your 
phone can now listen for specific sounds – a baby crying, smoke alarm, 
water running, etc. – and notify you. Amazing feature for all kinds of 
users – inclusivity at its best. #WWDC2020 "|https://news.google.com/stories/CAAqfQgKIndDQklTVXpvSmMzUnZjbmt0TXpZd1NrWUtFUWlFaE1tSWtJQU1FWW9FdkRrRy1DX0hFakZCY0hCc1pTZHpJRmR2Y214a2QybGtaU0JFWlhabGJHOXdaWEp6SUVOdmJtWmxjbVZ1WTJVZ2NISmxkbWxsZDJWa0tBQVAB?hl=en-US&gl=US&ceid=US%3Aen
"With Back Tap, you can perform various action by double or tripple tap on 
the back of your iPhone. Here’s one I set double tap to take screenshot. 
"|https://news.google.com/stories/CAAqfQgKIndDQklTVXpvSmMzUnZjbmt0TXpZd1NrWUtFUWlFaE1tSWtJQU1FWW9FdkRrRy1DX0hFakZCY0hCc1pTZHpJRmR2Y214a2QybGtaU0JFWlhabGJHOXdaWEp6SUVOdmJtWmxjbVZ1WTJVZ2NISmxkbWxsZDJWa0tBQVAB?hl=en-US&gl=US&ceid=US%3Aen
Buried on the iOS and iPadOS feature slide... |https://news.google.com/stories/CAAqfQgKIndDQklTVXpvSmMzUnZjbmt0TXpZd1NrWUtFUWlFaE1tSWtJQU1FWW9FdkRrRy1DX0hFakZCY0hCc1pTZHpJRmR2Y214a2QybGtaU0JFWlhabGJHOXdaWEp6SUVOdmJtWmxjbVZ1WTJVZ2NISmxkbWxsZDJWa0tBQVAB?hl=en-US&gl=US&ceid=US%3Aen
"Like Apple, this nation of immigrants has always found strength in our 
diversity, and hope in the enduring promise of the American Dream. There is 
no new prosperity without both. Deeply disappointed by this proclamation."|https://news.google.com/stories/CAAqOQgKIjNDQklTSURvSmMzUnZjbmt0TXpZd1NoTUtFUWo5c0s2SGtJQU1FZWNieGltQl96TmpLQUFQAQ?hl=en-US&gl=US&ceid=US%3Aen
"This year’s #WWDC20 student developers are creating apps that do incredible 
things like help prepare for pandemics, reduce our carbon footprints and 
connect victims of sexual assault with resources they need. Amazing to see 
how they’re dreaming big and changing the world. "|https://news.google.com/stories/CAAqOQgKIjNDQklTSURvSmMzUnZjbmt0TXpZd1NoTUtFUWo5c0s2SGtJQU1FZWNieGltQl96TmpLQUFQAQ?hl=en-US&gl=US&ceid=US%3Aen
"I really wish @Apple could tell us where we can find this ambient music 
they played before the start of #WWDC20 "|https://news.google.com/stories/CAAqOQgKIjNDQklTSURvSmMzUnZjbmt0TXpZd1NoTUtFUWo5c0s2SGtJQU1FZWNieGltQl96TmpLQUFQAQ?hl=en-US&gl=US&ceid=US%3Aen
 @tim_cook|https://news.google.com/stories/CAAqOQgKIjNDQklTSURvSmMzUnZjbmt0TXpZd1NoTUtFUWo5c0s2SGtJQU1FZWNieGltQl96TmpLQUFQAQ?hl=en-US&gl=US&ceid=US%3Aen
"This should be something everyone is talking about today. @tim_cook — drop 
the man a line. "|https://news.google.com/stories/CAAqOQgKIjNDQklTSURvSmMzUnZjbmt0TXpZd1NoTUtFUWo5c0s2SGtJQU1FZWNieGltQl96TmpLQUFQAQ?hl=en-US&gl=US&ceid=US%3Aen
"iOS 14 has a new Back Tap feature in Accessibility and it's wild. You can 
perform quick actions by double- or triple-tapping the *back of your 
iPhone*. Literally quick taps on the back; works with a case on. These 
include system actions as well as custom shortcuts. "|https://news.google.com/stories/CAAqOQgKIjNDQklTSURvSmMzUnZjbmt0TXpZd1NoTUtFUWlSeUpxQ2tJQU1FWTQ5SVVYdVYyekdLQUFQAQ?hl=en-US&gl=US&ceid=US%3Aen
"iOS 14 comes with support for Sound Recognition in Accessibility. Your 
phone can now listen for specific sounds – a baby crying, smoke alarm, 
water running, etc. – and notify you. Amazing feature for all kinds of 
users – inclusivity at its best. #WWDC2020 "|https://news.google.com/stories/CAAqOQgKIjNDQklTSURvSmMzUnZjbmt0TXpZd1NoTUtFUWlSeUpxQ2tJQU1FWTQ5SVVYdVYyekdLQUFQAQ?hl=en-US&gl=US&ceid=US%3Aen
"With Back Tap, you can perform various action by double or tripple tap on 
the back of your iPhone. Here’s one I set double tap to take screenshot. 
"|https://news.google.com/stories/CAAqOQgKIjNDQklTSURvSmMzUnZjbmt0TXpZd1NoTUtFUWlSeUpxQ2tJQU1FWTQ5SVVYdVYyekdLQUFQAQ?hl=en-US&gl=US&ceid=US%3Aen
"I just had an entire convo with an @Apple rep who totally failed even the 
basic Turing test. Me: Question Rep: Yes, here's an answer to a different 
question Me: But that's not my question Rep: Oh, okay, here's the same 
answer "|https://news.google.com/stories/CAAqOQgKIjNDQklTSURvSmMzUnZjbmt0TXpZd1NoTUtFUWlSeUpxQ2tJQU1FWTQ5SVVYdVYyekdLQUFQAQ?hl=en-US&gl=US&ceid=US%3Aen
"Wow. I'm literally stunned. Apple just doubled down on their rejection of 
HEY's ability to provide bug fixes and new features, unless we submit to 
their outrageous demand of 15-30% of our revenue. Even worse: We're told 
that unless we comply, they'll REMOVE THE APP."|https://news.google.com/stories/CAAqOQgKIjNDQklTSURvSmMzUnZjbmt0TXpZd1NoTUtFUWpkOWI2SGtJQU1FZk5HSDlyLW1RZlZLQUFQAQ?hl=en-US&gl=US&ceid=US%3Aen
"For all the snark and exasperation, we're going to take @pschiller up on 
this offer: ""There are many things that they could do to make the app work 
within the rules that we have. We would love for them to do that"". We won't 
ever do IAP, but try some of the other ""many things""."|https://news.google.com/stories/CAAqOQgKIjNDQklTSURvSmMzUnZjbmt0TXpZd1NoTUtFUWpkOWI2SGtJQU1FZk5HSDlyLW1RZlZLQUFQAQ?hl=en-US&gl=US&ceid=US%3Aen
"I just had an entire convo with an @Apple rep who totally failed even the 
basic Turing test. Me: Question Rep: Yes, here's an answer to a different 
question Me: But that's not my question Rep: Oh, okay, here's the same 
answer "|https://news.google.com/stories/CAAqOQgKIjNDQklTSURvSmMzUnZjbmt0TXpZd1NoTUtFUWpkOWI2SGtJQU1FZk5HSDlyLW1RZlZLQUFQAQ?hl=en-US&gl=US&ceid=US%3Aen
"Apple screws around with App Store billing (2019 revenue: ~$15bn): all hell 
breaks looks Apple starts to dismantle half the online ad business…🦗"|https://news.google.com/stories/CAAqOQgKIjNDQklTSURvSmMzUnZjbmt0TXpZd1NoTUtFUWpkOWI2SGtJQU1FZk5HSDlyLW1RZlZLQUFQAQ?hl=en-US&gl=US&ceid=US%3Aen
"Apple Teams with A24 on 'Sharper', a Con Artist Movie Starring Julianne 
Moore "|https://news.google.com/stories/CAAqOQgKIjNDQklTSURvSmMzUnZjbmt0TXpZd1NoTUtFUWpkOHRLSWtJQU1FWFZLM1BseWdJSGFLQUFQAQ?hl=en-US&gl=US&ceid=US%3Aen
 |https://news.google.com/stories/CAAqOQgKIjNDQklTSURvSmMzUnZjbmt0TXpZd1NoTUtFUWpkOHRLSWtJQU1FWFZLM1BseWdJSGFLQUFQAQ?hl=en-US&gl=US&ceid=US%3Aen
"Apple & A24 Team For Julianne Moore Con Artist Feature ‘Sharper’ – Deadline 
"|https://news.google.com/stories/CAAqOQgKIjNDQklTSURvSmMzUnZjbmt0TXpZd1NoTUtFUWpkOHRLSWtJQU1FWFZLM1BseWdJSGFLQUFQAQ?hl=en-US&gl=US&ceid=US%3Aen
"I just had an entire convo with an @Apple rep who totally failed even the 
basic Turing test. Me: Question Rep: Yes, here's an answer to a different 
question Me: But that's not my question Rep: Oh, okay, here's the same 
answer "|https://news.google.com/stories/CAAqOQgKIjNDQklTSURvSmMzUnZjbmt0TXpZd1NoTUtFUWl0cjRPQ2tJQU1FYjFkOXBDaXJtcmVLQUFQAQ?hl=en-US&gl=US&ceid=US%3Aen
"A sobering and important lesson from @nicolebyer about not waiting for your 
weight to allow you to have fun. 👇🏽 look at this whole year, nothing is 
ever truly predictable. Plans change. Live now: our podcast episode is out 
now on @Apple @Spotify I Weigh with Jameela Jamil "|https://news.google.com/stories/CAAqOQgKIjNDQklTSURvSmMzUnZjbmt0TXpZd1NoTUtFUWl0cjRPQ2tJQU1FYjFkOXBDaXJtcmVLQUFQAQ?hl=en-US&gl=US&ceid=US%3Aen
"Exclusive on DOJ looking at antitrust investigation of @Apple 
"|https://news.google.com/stories/CAAqOQgKIjNDQklTSURvSmMzUnZjbmt0TXpZd1NoTUtFUWl0cjRPQ2tJQU1FYjFkOXBDaXJtcmVLQUFQAQ?hl=en-US&gl=US&ceid=US%3Aen
 via @politico|https://news.google.com/stories/CAAqOQgKIjNDQklTSURvSmMzUnZjbmt0TXpZd1NoTUtFUWl0cjRPQ2tJQU1FYjFkOXBDaXJtcmVLQUFQAQ?hl=en-US&gl=US&ceid=US%3Aen
"MacBook Pro 2020 13″: Apple’s unforgivable sin (the video) 
"|https://news.google.com/stories/CAAqOQgKIjNDQklTSURvSmMzUnZjbmt0TXpZd1NoTUtFUWl0cjRPQ2tJQU1FYjFkOXBDaXJtcmVLQUFQAQ?hl=en-US&gl=US&ceid=US%3Aen
"Court invalidates $BIIB patent on blockbuster multiple sclerosis drug 
"|https://news.google.com/stories/CAAqOQgKIjNDQklTSURvSmMzUnZjbmt0TXpZd1NoTUtFUWlCekxxSWtJQU1FYkZjd3JHUUZrYWtLQUFQAQ?hl=en-US&gl=US&ceid=US%3Aen
" $MYL wins. And of course, let's restart the ""Who 
will Biogen buy now?"" chatter! It beats talking about Covid, right?"|https://news.google.com/stories/CAAqOQgKIjNDQklTSURvSmMzUnZjbmt0TXpZd1NoTUtFUWlCekxxSWtJQU1FYkZjd3JHUUZrYWtLQUFQAQ?hl=en-US&gl=US&ceid=US%3Aen
"Court invalidates Biogen’s patent on blockbuster multiple sclerosis drug. 
@adamfeuerstein writes: "|https://news.google.com/stories/CAAqOQgKIjNDQklTSURvSmMzUnZjbmt0TXpZd1NoTUtFUWlCekxxSWtJQU1FYkZjd3JHUUZrYWtLQUFQAQ?hl=en-US&gl=US&ceid=US%3Aen
Biogen Can Bounce Back from Multiple-Sclerosis Blow |https://news.google.com/stories/CAAqOQgKIjNDQklTSURvSmMzUnZjbmt0TXpZd1NoTUtFUWlCekxxSWtJQU1FYkZjd3JHUUZrYWtLQUFQAQ?hl=en-US&gl=US&ceid=US%3Aen
"Biogen's patent on its blockbuster MS drug Tecfidera invalidated by judge 
in West Virginia, opening door to Mylan's generic, possibly within days."|https://news.google.com/stories/CAAqOQgKIjNDQklTSURvSmMzUnZjbmt0TXpZd1NoTUtFUWlCekxxSWtJQU1FYkZjd3JHUUZrYWtLQUFQAQ?hl=en-US&gl=US&ceid=US%3Aen
"I am so hyped right now, this is so much more than I would have guessed 
after the initial trailer leak, this has temendous potential Star Wars: 
Squadrons - FULL Gameplay Reveal Presentation | EA Play 2020 
"|https://news.google.com/stories/CAAqOQgKIjNDQklTSURvSmMzUnZjbmt0TXpZd1NoTUtFUWktOGZqLWo0QU1FWDlna3k1eGZWY0tLQUFQAQ?hl=en-US&gl=US&ceid=US%3Aen
