tweet|covering_link
"RIP Flash Player: Adobe says you have this much time to uninstall app 
"|https://news.google.com/stories/CAAqOQgKIjNDQklTSURvSmMzUnZjbmt0TXpZd1NoTUtFUWkyOVppQ2tJQU1FZFZSajhLZkVIU1BLQUFQAQ?hl=en-US&gl=US&ceid=US%3Aen
"ICYMI Millions of websites face being crippled when Adobe Flash is 
withdrawn at the end of this year "|https://news.google.com/stories/CAAqOQgKIjNDQklTSURvSmMzUnZjbmt0TXpZd1NoTUtFUWkyOVppQ2tJQU1FZFZSajhLZkVIU1BLQUFQAQ?hl=en-US&gl=US&ceid=US%3Aen
"Adobe wants users to uninstall Flash Player by the end of the year So... 
When are we going to see an influx of lame (mostly Mac targeted) flash 
uninstaller malware? "|https://news.google.com/stories/CAAqOQgKIjNDQklTSURvSmMzUnZjbmt0TXpZd1NoTUtFUWkyOVppQ2tJQU1FZFZSajhLZkVIU1BLQUFQAQ?hl=en-US&gl=US&ceid=US%3Aen
 via @ZDNet & @campuscodi|https://news.google.com/stories/CAAqOQgKIjNDQklTSURvSmMzUnZjbmt0TXpZd1NoTUtFUWkyOVppQ2tJQU1FZFZSajhLZkVIU1BLQUFQAQ?hl=en-US&gl=US&ceid=US%3Aen
"r/t New Mac malware spreads disguised as Flash Player installer via Google 
search results "|https://news.google.com/stories/CAAqOQgKIjNDQklTSURvSmMzUnZjbmt0TXpZd1NoTUtFUWkyOVppQ2tJQU1FZFZSajhLZkVIU1BLQUFQAQ?hl=en-US&gl=US&ceid=US%3Aen
"Can't wait to see how long it will take Adobe Premiere Pro to open on an 
ARM chip."|https://news.google.com/stories/CAAqOQgKIjNDQklTSURvSmMzUnZjbmt0TXpZd1NoTUtFUWpYeVlTQ2tJQU1FU3B6ZXp1b1BRUGhLQUFQAQ?hl=en-US&gl=US&ceid=US%3Aen
New Effects Panel Coming Soon to Adobe Premiere Rush |https://news.google.com/stories/CAAqOQgKIjNDQklTSURvSmMzUnZjbmt0TXpZd1NoTUtFUWpYeVlTQ2tJQU1FU3B6ZXp1b1BRUGhLQUFQAQ?hl=en-US&gl=US&ceid=US%3Aen
"The @DundasMedia team in Sydney has been very busy this past week creating 
a killer new commercial for a new client of mine. Not giving too much away 
right now, but below you can see what this video looks like currently being 
edited in Adobe Premiere. This has been my view! "|https://news.google.com/stories/CAAqOQgKIjNDQklTSURvSmMzUnZjbmt0TXpZd1NoTUtFUWpYeVlTQ2tJQU1FU3B6ZXp1b1BRUGhLQUFQAQ?hl=en-US&gl=US&ceid=US%3Aen
"Mel Gibson, Aubrey Huff, amd Mitch McConnell are all trending... Okay where 
is the Klan rally being held at?"|https://news.google.com/stories/CAAqOQgKIjNDQklTSURvSmMzUnZjbmt0TXpZd1NoTUtFUWozcVBxQmtJQU1FVmhiendvQXdZNHFLQUFQAQ?hl=en-US&gl=US&ceid=US%3Aen
"The AMD Radeon 5600 XT is poetry in graphics card form. Would you like to 
win one? - Reply with your best haiku about the graphics card before July 
1st - Follow @AMD_AUNZ me and @Jenzlinger - Reply to @jenzlinger's AMD post 
for a SECOND chance to win! (AU and NZ entries only) "|https://news.google.com/stories/CAAqOQgKIjNDQklTSURvSmMzUnZjbmt0TXpZd1NoTUtFUWozcVBxQmtJQU1FVmhiendvQXdZNHFLQUFQAQ?hl=en-US&gl=US&ceid=US%3Aen
"Hank Williams, Gram Parsons amd Jeff Buckley all sang the heck out of 
Satisfied Mind, a song about inner peace being more important than money. 
They all died by 30."|https://news.google.com/stories/CAAqOQgKIjNDQklTSURvSmMzUnZjbmt0TXpZd1NoTUtFUWozcVBxQmtJQU1FVmhiendvQXdZNHFLQUFQAQ?hl=en-US&gl=US&ceid=US%3Aen
"HE DID IT! @StormChaseTV with a successful test of high-speed drone for 
deployment of sensor package into tornadoes amd other storms. He built this 
drone with his bare hands. We are hoping to deploy during northern Plains 
season. @ChasinSpin "|https://news.google.com/stories/CAAqOQgKIjNDQklTSURvSmMzUnZjbmt0TXpZd1NoTUtFUWozcVBxQmtJQU1FVmhiendvQXdZNHFLQUFQAQ?hl=en-US&gl=US&ceid=US%3Aen
"Mel Gibson, Aubrey Huff, amd Mitch McConnell are all trending... Okay where 
is the Klan rally being held at?"|https://news.google.com/stories/CAAqOQgKIjNDQklTSURvSmMzUnZjbmt0TXpZd1NoTUtFUWpqbVAyQWtJQU1FZUpZOUViejNDM0FLQUFQAQ?hl=en-US&gl=US&ceid=US%3Aen
"The AMD Radeon 5600 XT is poetry in graphics card form. Would you like to 
win one? - Reply with your best haiku about the graphics card before July 
1st - Follow @AMD_AUNZ me and @Jenzlinger - Reply to @jenzlinger's AMD post 
for a SECOND chance to win! (AU and NZ entries only) "|https://news.google.com/stories/CAAqOQgKIjNDQklTSURvSmMzUnZjbmt0TXpZd1NoTUtFUWpqbVAyQWtJQU1FZUpZOUViejNDM0FLQUFQAQ?hl=en-US&gl=US&ceid=US%3Aen
"Hank Williams, Gram Parsons amd Jeff Buckley all sang the heck out of 
Satisfied Mind, a song about inner peace being more important than money. 
They all died by 30."|https://news.google.com/stories/CAAqOQgKIjNDQklTSURvSmMzUnZjbmt0TXpZd1NoTUtFUWpqbVAyQWtJQU1FZUpZOUViejNDM0FLQUFQAQ?hl=en-US&gl=US&ceid=US%3Aen
"HE DID IT! @StormChaseTV with a successful test of high-speed drone for 
deployment of sensor package into tornadoes amd other storms. He built this 
drone with his bare hands. We are hoping to deploy during northern Plains 
season. @ChasinSpin "|https://news.google.com/stories/CAAqOQgKIjNDQklTSURvSmMzUnZjbmt0TXpZd1NoTUtFUWpqbVAyQWtJQU1FZUpZOUViejNDM0FLQUFQAQ?hl=en-US&gl=US&ceid=US%3Aen
"Adobe: We're opening up Lightroom tutorials so anyone can submit them! 
User: Now I have to shield my child's eyes from ""fashion"" photos of nekkid 
people in Lightroom "|https://news.google.com/stories/CAAqOQgKIjNDQklTSURvSmMzUnZjbmt0TXpZd1NoTUtFUWp6Z182QWtJQU1FV05wdEtQRG5Rb1VLQUFQAQ?hl=en-US&gl=US&ceid=US%3Aen
"gonna be super awk when Apple’s first ARM Mac comes out and Lightroom works 
on it from day one and it still doesn’t even open on Windows on ARM"|https://news.google.com/stories/CAAqOQgKIjNDQklTSURvSmMzUnZjbmt0TXpZd1NoTUtFUWp6Z182QWtJQU1FV05wdEtQRG5Rb1VLQUFQAQ?hl=en-US&gl=US&ceid=US%3Aen
"I gotta YouTube how to get these film look still on Lightroom because I’m 
seeing too much beauty on the TL 😭"|https://news.google.com/stories/CAAqOQgKIjNDQklTSURvSmMzUnZjbmt0TXpZd1NoTUtFUWp6Z182QWtJQU1FV05wdEtQRG5Rb1VLQUFQAQ?hl=en-US&gl=US&ceid=US%3Aen
"Microsoft and Adobe have already gotten started. Apple A12Z Bionic runs 
Apple Developer Platform. Same Mac we used to demo macOS apps earlier. 
(Steve nod!) Office, Lightroom already running native. 
"|https://news.google.com/stories/CAAqOQgKIjNDQklTSURvSmMzUnZjbmt0TXpZd1NoTUtFUWp6Z182QWtJQU1FV05wdEtQRG5Rb1VLQUFQAQ?hl=en-US&gl=US&ceid=US%3Aen
"Charter Seeks FCC Nod to Charge Video Streamers | Charter wants permission 
to begin charging Netflix, HBO Max, Disney+ and other streamers for the 
pleasure of efficiently carrying its traffic. "|https://news.google.com/stories/CAAqOQgKIjNDQklTSURvSmMzUnZjbmt0TXpZd1NoTUtFUWoxZ29lQmtJQU1FUnNkU2puaF9nWFlLQUFQAQ?hl=en-US&gl=US&ceid=US%3Aen
" via 
@thr"|https://news.google.com/stories/CAAqOQgKIjNDQklTSURvSmMzUnZjbmt0TXpZd1NoTUtFUWoxZ29lQmtJQU1FUnNkU2puaF9nWFlLQUFQAQ?hl=en-US&gl=US&ceid=US%3Aen
"The new #Renoir APU works pretty fine without any cooling solution 🙃 
"|https://news.google.com/stories/CAAqOQgKIjNDQklTSURvSmMzUnZjbmt0TXpZd1NoTUtFUWpJX09lQWtJQU1FVFRsY05LQm5RLVNLQUFQAQ?hl=en-US&gl=US&ceid=US%3Aen
Microsoft AMD Ryzen 7 4800U |https://news.google.com/stories/CAAqOQgKIjNDQklTSURvSmMzUnZjbmt0TXpZd1NoTUtFUWpJX09lQWtJQU1FVFRsY05LQm5RLVNLQUFQAQ?hl=en-US&gl=US&ceid=US%3Aen
"Win this beast = In case you missed it, we are doing a giveaway for an 
ORIGIN PC EON15-X 💻 powered by a 12 core @AMD Ryzen 3900 processor, 
enabling revolutionary desktop performance and productivity on a laptop! ⚡⁣ 
⁣ Sign up for a chance to win in the @originpc bio link! 🌐 
"|https://news.google.com/stories/CAAqOQgKIjNDQklTSURvSmMzUnZjbmt0TXpZd1NoTUtFUWpJX09lQWtJQU1FVFRsY05LQm5RLVNLQUFQAQ?hl=en-US&gl=US&ceid=US%3Aen
"Congratulations to @ogresdenn who won the @AMD_AUNZ CPU Hat competition! 
Good job, hunter! Enjoy your Ryzen 5 3600! Thanks to all who entered, new 
comp soon! "|https://news.google.com/stories/CAAqOQgKIjNDQklTSURvSmMzUnZjbmt0TXpZd1NoTUtFUWpJX09lQWtJQU1FVFRsY05LQm5RLVNLQUFQAQ?hl=en-US&gl=US&ceid=US%3Aen
".@amazon is hosting its first-ever Big Style Sale this week with deals on 
all things fashion up to 50% off! I’m sharing more details including what 
you should hold off from buying today on the news at 3 & 4pm! @abc13houston"|https://news.google.com/stories/CAAqOQgKIjNDQklTSURvSmMzUnZjbmt0TXpZd1NoTUtFUWp6XzdHQ2tJQU1FWHZfdmhQN1hIaE1LQUFQAQ?hl=en-US&gl=US&ceid=US%3Aen
"NEW: Facebook, Google chiefs open to testifying to Congress on antitrust, 
while Apple’s participation remains unclear. (It didn't explicitly commit 
Cook.) Amazon previously said Bezos would under conditions. 
"|https://news.google.com/stories/CAAqOQgKIjNDQklTSURvSmMzUnZjbmt0TXpZd1NoTUtFUWpxaF9HQWtJQU1FZUZEektveFJvV0FLQUFQAQ?hl=en-US&gl=US&ceid=US%3Aen
"""Lawmakers also have asked [CEO's from Apple, Facebook, and Google] to join 
Bezos and testify at an upcoming hearing.. to cap off more than a year of 
work by the House committee to study Silicon Valley for potential antitrust 
violations"", can I submit a Q? "|https://news.google.com/stories/CAAqOQgKIjNDQklTSURvSmMzUnZjbmt0TXpZd1NoTUtFUWpxaF9HQWtJQU1FZUZEektveFJvV0FLQUFQAQ?hl=en-US&gl=US&ceid=US%3Aen
"Jeff Bezos is now willing to testify before Congress after Nadler and 
Cicilline threatened subpoena, after Amazon was caught lying about using 
seller data. But still acts like a King, trying to control format. No. The 
people set the terms. "|https://news.google.com/stories/CAAqOQgKIjNDQklTSURvSmMzUnZjbmt0TXpZd1NoTUtFUWpxaF9HQWtJQU1FZUZEektveFJvV0FLQUFQAQ?hl=en-US&gl=US&ceid=US%3Aen
"Amazon's Bezos willing to testify before House panel: report 
"|https://news.google.com/stories/CAAqOQgKIjNDQklTSURvSmMzUnZjbmt0TXpZd1NoTUtFUWpxaF9HQWtJQU1FZUZEektveFJvV0FLQUFQAQ?hl=en-US&gl=US&ceid=US%3Aen
"I just had an entire convo with an @Apple rep who totally failed even the 
basic Turing test. Me: Question Rep: Yes, here's an answer to a different 
question Me: But that's not my question Rep: Oh, okay, here's the same 
answer "|https://news.google.com/stories/CAAqOQgKIjNDQklTSURvSmMzUnZjbmt0TXpZd1NoTUtFUWlEenBDQWtJQU1FWF8wZEFwTENHOXhLQUFQAQ?hl=en-US&gl=US&ceid=US%3Aen
"A sobering and important lesson from @nicolebyer about not waiting for your 
weight to allow you to have fun. 👇🏽 look at this whole year, nothing is 
ever truly predictable. Plans change. Live now: our podcast episode is out 
now on @Apple @Spotify I Weigh with Jameela Jamil "|https://news.google.com/stories/CAAqOQgKIjNDQklTSURvSmMzUnZjbmt0TXpZd1NoTUtFUWlEenBDQWtJQU1FWF8wZEFwTENHOXhLQUFQAQ?hl=en-US&gl=US&ceid=US%3Aen
"Exclusive on DOJ looking at antitrust investigation of @Apple 
"|https://news.google.com/stories/CAAqOQgKIjNDQklTSURvSmMzUnZjbmt0TXpZd1NoTUtFUWlEenBDQWtJQU1FWF8wZEFwTENHOXhLQUFQAQ?hl=en-US&gl=US&ceid=US%3Aen
 via @politico|https://news.google.com/stories/CAAqOQgKIjNDQklTSURvSmMzUnZjbmt0TXpZd1NoTUtFUWlEenBDQWtJQU1FWF8wZEFwTENHOXhLQUFQAQ?hl=en-US&gl=US&ceid=US%3Aen
"MacBook Pro 2020 13″: Apple’s unforgivable sin (the video) 
"|https://news.google.com/stories/CAAqOQgKIjNDQklTSURvSmMzUnZjbmt0TXpZd1NoTUtFUWlEenBDQWtJQU1FWF8wZEFwTENHOXhLQUFQAQ?hl=en-US&gl=US&ceid=US%3Aen
"Amazon unveils Distance Assistant, an open source platform to enforce 
physical distancing among workers "|https://news.google.com/stories/CAAqOQgKIjNDQklTSURvSmMzUnZjbmt0TXpZd1NoTUtFUWlKblBPQmtJQU1FUzRteTY4Zy12QWFLQUFQAQ?hl=en-US&gl=US&ceid=US%3Aen
"Amazon is testing a wearable device that lights up and beeps when warehouse 
workers get too close to one another, @annierpalmer reports. The company is 
exploring if it could help with social distancing and contact tracing. 
"|https://news.google.com/stories/CAAqOQgKIjNDQklTSURvSmMzUnZjbmt0TXpZd1NoTUtFUWlKblBPQmtJQU1FUzRteTY4Zy12QWFLQUFQAQ?hl=en-US&gl=US&ceid=US%3Aen
"Amazon to use AI tech in its warehouses to enforce social distancing 
"|https://news.google.com/stories/CAAqOQgKIjNDQklTSURvSmMzUnZjbmt0TXpZd1NoTUtFUWlKblBPQmtJQU1FUzRteTY4Zy12QWFLQUFQAQ?hl=en-US&gl=US&ceid=US%3Aen
"As construction continues at Nashville Yards for Amazon, we're learning 
about new tech to maintain social distancing at its facilities. 
"|https://news.google.com/stories/CAAqOQgKIjNDQklTSURvSmMzUnZjbmt0TXpZd1NoTUtFUWlKblBPQmtJQU1FUzRteTY4Zy12QWFLQUFQAQ?hl=en-US&gl=US&ceid=US%3Aen
 @FOXNashville|https://news.google.com/stories/CAAqOQgKIjNDQklTSURvSmMzUnZjbmt0TXpZd1NoTUtFUWlKblBPQmtJQU1FUzRteTY4Zy12QWFLQUFQAQ?hl=en-US&gl=US&ceid=US%3Aen
"Trump is toast. He's given up on the coronavirus. Last week the generals 
said ‘go to hell,’ the Supreme Court ruled against him four different ways, 
the judges are slapping down his attorney general, his poll numbers are 
sinking. and he can't fill seats at his rallies. "|https://news.google.com/stories/CAAqOQgKIjNDQklTSURvSmMzUnZjbmt0TXpZd1NoTUtFUWo3MzdPQWtJQU1FWHVfdy13d1Y1QnRLQUFQAQ?hl=en-US&gl=US&ceid=US%3Aen
"BREAKING: Massachusetts Attorney General Maura Healey is taking 
"|https://news.google.com/stories/CAAqOQgKIjNDQklTSURvSmMzUnZjbmt0TXpZd1NoTUtFUWo3MzdPQWtJQU1FWHVfdy13d1Y1QnRLQUFQAQ?hl=en-US&gl=US&ceid=US%3Aen
" to court after she said the online travel agency 
ripped off travelers during the COVID-19 pandemic. "|https://news.google.com/stories/CAAqOQgKIjNDQklTSURvSmMzUnZjbmt0TXpZd1NoTUtFUWo3MzdPQWtJQU1FWHVfdy13d1Y1QnRLQUFQAQ?hl=en-US&gl=US&ceid=US%3Aen
" 
@boston25 @MassAGO "|https://news.google.com/stories/CAAqOQgKIjNDQklTSURvSmMzUnZjbmt0TXpZd1NoTUtFUWo3MzdPQWtJQU1FWHVfdy13d1Y1QnRLQUFQAQ?hl=en-US&gl=US&ceid=US%3Aen
"Today David Parker refused to resign as Attorney-General if the Supreme 
Court holds that the ‘lockdown’ prior to Parliament passing the COVID-19 
public health legislation was illegal. If he released the legal advice he 
says states that the lockdown was legal,"|https://news.google.com/stories/CAAqOQgKIjNDQklTSURvSmMzUnZjbmt0TXpZd1NoTUtFUWo3MzdPQWtJQU1FWHVfdy13d1Y1QnRLQUFQAQ?hl=en-US&gl=US&ceid=US%3Aen
"‘Solitary confinement in my bedroom’: Illinois attorney general describes 
his COVID-19 symptoms "|https://news.google.com/stories/CAAqOQgKIjNDQklTSURvSmMzUnZjbmt0TXpZd1NoTUtFUWo3MzdPQWtJQU1FWHVfdy13d1Y1QnRLQUFQAQ?hl=en-US&gl=US&ceid=US%3Aen
 via @SunTimes|https://news.google.com/stories/CAAqOQgKIjNDQklTSURvSmMzUnZjbmt0TXpZd1NoTUtFUWo3MzdPQWtJQU1FWHVfdy13d1Y1QnRLQUFQAQ?hl=en-US&gl=US&ceid=US%3Aen
"""I'm going to leave the conversations about vetting to the Biden campaign,"" 
@staceyabrams tells @mitchellreports reports when pressed about VP convos 
with team @JoeBiden"|https://news.google.com/stories/CAAqOQgKIjNDQklTSURvSmMzUnZjbmt0TXpZd1NoTUtFUWpmejVlRGtJQU1FZnhlLTMzXzhBS3pLQUFQAQ?hl=en-US&gl=US&ceid=US%3Aen
".@The_SEAP published our 1st research paper. From environmental justice 
work in college to my legislative efforts + advocacy through 
@WorldWarZeroOrg & @ClimatePower, I know that #ClimateAction is central to 
dismantling systemic inequities in the South. "|https://news.google.com/stories/CAAqOQgKIjNDQklTSURvSmMzUnZjbmt0TXpZd1NoTUtFUWpmejVlRGtJQU1FZnhlLTMzXzhBS3pLQUFQAQ?hl=en-US&gl=US&ceid=US%3Aen
"Tomorrow I’m interviewing @staceyabrams and I CAN’T WAIT. Sign up to join 
the convo: "|https://news.google.com/stories/CAAqOQgKIjNDQklTSURvSmMzUnZjbmt0TXpZd1NoTUtFUWpmejVlRGtJQU1FZnhlLTMzXzhBS3pLQUFQAQ?hl=en-US&gl=US&ceid=US%3Aen
 |https://news.google.com/stories/CAAqOQgKIjNDQklTSURvSmMzUnZjbmt0TXpZd1NoTUtFUWpmejVlRGtJQU1FZnhlLTMzXzhBS3pLQUFQAQ?hl=en-US&gl=US&ceid=US%3Aen
"My new book, #OurTimeIsNow, focuses on protecting the right to vote, the 
importance of safeguarding democracy in our country and around the world, 
and how you can be a part of the solution. Order yours today: 
"|https://news.google.com/stories/CAAqOQgKIjNDQklTSURvSmMzUnZjbmt0TXpZd1NoTUtFUWpmejVlRGtJQU1FZnhlLTMzXzhBS3pLQUFQAQ?hl=en-US&gl=US&ceid=US%3Aen
"Got a garden for Father’s Day from lovely wifey. Also Restorative Farms 
benefits local community. Some sage advice: Don’t parsley this up. Kale, 
Yeah! Ok bye "|https://news.google.com/stories/CAAqOQgKIjNDQklTSURvSmMzUnZjbmt0TXpZd1NoTUtFUWpMeTd1QmtJQU1FZVFvSmtfeTUzNUhLQUFQAQ?hl=en-US&gl=US&ceid=US%3Aen
"My kids are the best, and my younger one made me a tie for Father’s Day. I 
told him I’d wear it on a special occasion, and, well, today seemed to 
qualify. "|https://news.google.com/stories/CAAqOQgKIjNDQklTSURvSmMzUnZjbmt0TXpZd1NoTUtFUWpMeTd1QmtJQU1FZVFvSmtfeTUzNUhLQUFQAQ?hl=en-US&gl=US&ceid=US%3Aen
WE GOT LIT FOR FATHER’S DAY 😏 |https://news.google.com/stories/CAAqOQgKIjNDQklTSURvSmMzUnZjbmt0TXpZd1NoTUtFUWpMeTd1QmtJQU1FZVFvSmtfeTUzNUhLQUFQAQ?hl=en-US&gl=US&ceid=US%3Aen
 via @YouTube|https://news.google.com/stories/CAAqOQgKIjNDQklTSURvSmMzUnZjbmt0TXpZd1NoTUtFUWpMeTd1QmtJQU1FZVFvSmtfeTUzNUhLQUFQAQ?hl=en-US&gl=US&ceid=US%3Aen
"My father's day gift from my kids arrived last night. So this morning my 
wife said ""Guys, lets get daddy his gift"". Gift is opened and handed to me 
Alex ""we didn't get this for him"" A minute later his sister walks up to me 
Emmy ""Daddy, I didn't buy that for you"" 😂😂"|https://news.google.com/stories/CAAqOQgKIjNDQklTSURvSmMzUnZjbmt0TXpZd1NoTUtFUWpMeTd1QmtJQU1FZVFvSmtfeTUzNUhLQUFQAQ?hl=en-US&gl=US&ceid=US%3Aen
"Good night all💤💤💤 Off to bed early and setting my alarm clock ⚽ More 
@premierleague matches in the morning for 🇦🇺 football fans on @OptusSport 
⚽👍🏻 #ootussport #premierleague #football "|https://news.google.com/stories/CAAqOQgKIjNDQklTSURvSmMzUnZjbmt0TXpZd1NoTUtFUWlDOXNMX2o0QU1FZWkybUtraFEzNEtLQUFQAQ?hl=en-US&gl=US&ceid=US%3Aen
"A lot of talk about the @ManUtd midfield tonight but I’m really looking 
forward to seeing how #Greenwood goes, especially on the quick counter. 
#MUNSHU @premierleague"|https://news.google.com/stories/CAAqOQgKIjNDQklTSURvSmMzUnZjbmt0TXpZd1NoTUtFUWlDOXNMX2o0QU1FZWkybUtraFEzNEtLQUFQAQ?hl=en-US&gl=US&ceid=US%3Aen
"So...in latest round of @premierleague testing 17-21st June - 1829 tested 
&1 +ve test but @AdriaTennisTour 🎾 where they played w crowds & NO social 
distancing because it was ‘SAFE’ to do so - of the 8 players 4 have tested 
+ve PLUS wives & coaches - SO wasn’t safe #soreckless😷 
"|https://news.google.com/stories/CAAqOQgKIjNDQklTSURvSmMzUnZjbmt0TXpZd1NoTUtFUWlDOXNMX2o0QU1FZWkybUtraFEzNEtLQUFQAQ?hl=en-US&gl=US&ceid=US%3Aen
"#PlayersTogether launch #ShirtsforChange raffle on eBay UK, of 
specially-designed Black Lives Matters football shirts, which they have 
been wearing since the Premier League has returned. All funds raised will 
be donated to The Stephen Lawrence Charitable Trust."|https://news.google.com/stories/CAAqOQgKIjNDQklTSURvSmMzUnZjbmt0TXpZd1NoTUtFUWlDOXNMX2o0QU1FZWkybUtraFEzNEtLQUFQAQ?hl=en-US&gl=US&ceid=US%3Aen
"Robert Julian-Borchak Williams was wrongfully arrested because racist 
facial recognition technology misidentified him for a crime he did not 
commit. We can't allow this to happen again. It's time to ban facial 
recognition technology for policing. "|https://news.google.com/stories/CAAqOQgKIjNDQklTSURvSmMzUnZjbmt0TXpZd1NoTUtFUWpwalptQ2tJQU1FU1pSWURPWUt3RFNLQUFQAQ?hl=en-US&gl=US&ceid=US%3Aen
"A Black man in Detroit was wrongfully arrested by police who mis-identified 
him with a false facial recognition hit. Robert Williams was held in police 
custody for a day. It's the first publicly reported case of AI resulting in 
a false arrest in the US. "|https://news.google.com/stories/CAAqOQgKIjNDQklTSURvSmMzUnZjbmt0TXpZd1NoTUtFUWpwalptQ2tJQU1FU1pSWURPWUt3RFNLQUFQAQ?hl=en-US&gl=US&ceid=US%3Aen
"Michigan police say facial recognition is just for investigative leads and 
the onus is on the investigators to make sure they're right. 
Understandable, but doesn't change the fact that the tech has been proven, 
repeatedly, to be bias against Black people: "|https://news.google.com/stories/CAAqOQgKIjNDQklTSURvSmMzUnZjbmt0TXpZd1NoTUtFUWpwalptQ2tJQU1FU1pSWURPWUt3RFNLQUFQAQ?hl=en-US&gl=US&ceid=US%3Aen
"Detroit police challenged over ""unthinkingly"" relying on facial recognition 
technology that mistakenly identified Black man, leading to humiliating 
arrest outside his home "|https://news.google.com/stories/CAAqOQgKIjNDQklTSURvSmMzUnZjbmt0TXpZd1NoTUtFUWpwalptQ2tJQU1FU1pSWURPWUt3RFNLQUFQAQ?hl=en-US&gl=US&ceid=US%3Aen
"I love them all, but the Show 5 is definitely one of my family's favs. =) 
--> Readers tell us why the Echo Show 5 is their ideal smart display | 
Engadget "|https://news.google.com/stories/CAAqOQgKIjNDQklTSURvSmMzUnZjbmt0TXpZd1NoTUtFUWkyck15Q2tJQU1FWEctSDUtSFFGQzVLQUFQAQ?hl=en-US&gl=US&ceid=US%3Aen
 #Alexa #VoiceFirst |https://news.google.com/stories/CAAqOQgKIjNDQklTSURvSmMzUnZjbmt0TXpZd1NoTUtFUWkyck15Q2tJQU1FWEctSDUtSFFGQzVLQUFQAQ?hl=en-US&gl=US&ceid=US%3Aen
"Baby Thinks Her Name is 'Alexa' After Hearing Parents Talk to Amazon Echo 
[Video] "|https://news.google.com/stories/CAAqOQgKIjNDQklTSURvSmMzUnZjbmt0TXpZd1NoTUtFUWkyck15Q2tJQU1FWEctSDUtSFFGQzVLQUFQAQ?hl=en-US&gl=US&ceid=US%3Aen
"“Alexa, remind me in 15 minutes that I diced this 
parsley/sage/cilantro/etc. to use for garnish, not to leave in a pile on a 
cutting board”: one of my under-utilized kitchen-Echo use cases."|https://news.google.com/stories/CAAqOQgKIjNDQklTSURvSmMzUnZjbmt0TXpZd1NoTUtFUWkyck15Q2tJQU1FWEctSDUtSFFGQzVLQUFQAQ?hl=en-US&gl=US&ceid=US%3Aen
"I dont have an Amazon echo, but if I did I’d yell “Alexa get in here right 
now!” constantly until it self destructed."|https://news.google.com/stories/CAAqOQgKIjNDQklTSURvSmMzUnZjbmt0TXpZd1NoTUtFUWkyck15Q2tJQU1FWEctSDUtSFFGQzVLQUFQAQ?hl=en-US&gl=US&ceid=US%3Aen
"Need a vocalist to sing a verse on a song. The lyrics are written, just 
need your performance to finish it all up 🎤 More info here: 
"|https://news.google.com/stories/CAAqZAgKIl5DQklTUURvSmMzUnZjbmt0TXpZd1NqTUtFUWlrNGNtQ2tJQU1FWWRSV1lqdGliTGNFaDRuTnpVd01DY2dZbmtnU205elpYQm9JRWR2Y21SdmJpMU1aWFpwZEhRb0FBUAE?hl=en-US&gl=US&ceid=US%3Aen
"Write a 6 word story about this photo of a woman going ""🤫"" Can be funny, 
sad, weird, sincere, mysterious... all up to you. :) Add your writing here: 
"|https://news.google.com/stories/CAAqZAgKIl5DQklTUURvSmMzUnZjbmt0TXpZd1NqTUtFUWlrNGNtQ2tJQU1FWWRSV1lqdGliTGNFaDRuTnpVd01DY2dZbmtnU205elpYQm9JRWR2Y21SdmJpMU1aWFpwZEhRb0FBUAE?hl=en-US&gl=US&ceid=US%3Aen
 |https://news.google.com/stories/CAAqZAgKIl5DQklTUURvSmMzUnZjbmt0TXpZd1NqTUtFUWlrNGNtQ2tJQU1FWWRSV1lqdGliTGNFaDRuTnpVd01DY2dZbmtnU205elpYQm9JRWR2Y21SdmJpMU1aWFpwZEhRb0FBUAE?hl=en-US&gl=US&ceid=US%3Aen
"7500, the new Joseph Gordon-Levitt movie available for streaming on Prime, 
is a claustrophobic hijacking thriller that cleverly builds and sustains 
tension with its unique decision to never leave the cockpit. Spoiler-free 
review for this week’s Long Shot. "|https://news.google.com/stories/CAAqZAgKIl5DQklTUURvSmMzUnZjbmt0TXpZd1NqTUtFUWlrNGNtQ2tJQU1FWWRSV1lqdGliTGNFaDRuTnpVd01DY2dZbmtnU205elpYQm9JRWR2Y21SdmJpMU1aWFpwZEhRb0FBUAE?hl=en-US&gl=US&ceid=US%3Aen
"Watching 7500 on #AmazonPrime with @hitRECordJoe - this thing will make you 
clinch squirt diamonds it's so intense... DYING - so intense"|https://news.google.com/stories/CAAqZAgKIl5DQklTUURvSmMzUnZjbmt0TXpZd1NqTUtFUWlrNGNtQ2tJQU1FWWRSV1lqdGliTGNFaDRuTnpVd01DY2dZbmtnU205elpYQm9JRWR2Y21SdmJpMU1aWFpwZEhRb0FBUAE?hl=en-US&gl=US&ceid=US%3Aen
"Enter for a chance to win 55+ First in Series Women Sleuth Mysteries from 
your favorite bestselling and award-winning authors via @BookSweeps, plus a 
brand new Kindle Fire or Nook Tablet! #AmReading #Bookworm 
"|https://news.google.com/stories/CAAqOQgKIjNDQklTSURvSmMzUnZjbmt0TXpZd1NoTUtFUWpGb1BtQ2tJQU1FZWpDcXpzMFhKa2pLQUFQAQ?hl=en-US&gl=US&ceid=US%3Aen
"Come cook along with me LIVE today at 4pm ET on the #FoodNetworkKitchen 
app! Download the app today and start your 60-day free trial — Plus, new 
and existing Amazon FireTV and Fire Tablet users can get a complimentary 
1-year subscription to Food Network Kitchen!"|https://news.google.com/stories/CAAqOQgKIjNDQklTSURvSmMzUnZjbmt0TXpZd1NoTUtFUWpGb1BtQ2tJQU1FZWpDcXpzMFhKa2pLQUFQAQ?hl=en-US&gl=US&ceid=US%3Aen
"PlayStation 5 Price: 499€? Digital Edition: 399€? Not bad 👌 
"|https://news.google.com/stories/CAAqOQgKIjNDQklTSURvSmMzUnZjbmt0TXpZd1NoTUtFUWlYdTZLRGtJQU1FYVh0NEFrZmlJRU5LQUFQAQ?hl=en-US&gl=US&ceid=US%3Aen
"“There's no bigger selling point for the upcoming @PlayStation 5 than 
Spider-Man: Miles Morales...@Marvel's Spider-Man is notable for drawing a 
great deal of inspiration from the comics...we assume #MilesMoralesPS5 will 
be no different.” Via @IGN = "|https://news.google.com/stories/CAAqOQgKIjNDQklTSURvSmMzUnZjbmt0TXpZd1NoTUtFUWlYdTZLRGtJQU1FYVh0NEFrZmlJRU5LQUFQAQ?hl=en-US&gl=US&ceid=US%3Aen
 |https://news.google.com/stories/CAAqOQgKIjNDQklTSURvSmMzUnZjbmt0TXpZd1NoTUtFUWlYdTZLRGtJQU1FYVh0NEFrZmlJRU5LQUFQAQ?hl=en-US&gl=US&ceid=US%3Aen
"🚨ACCOUNT WIN🚨 Omnicom's eg+ Worldwide wins global production account for 
PlayStation. The shop will aid creative work by adamandeveDDB. @PlayStation 
@Omnicom @egplusworldwide "|https://news.google.com/stories/CAAqOQgKIjNDQklTSURvSmMzUnZjbmt0TXpZd1NoTUtFUWlYdTZLRGtJQU1FYVh0NEFrZmlJRU5LQUFQAQ?hl=en-US&gl=US&ceid=US%3Aen
"Yo @PlayStation ... i need a refund on #TheLastofUsPartII ASAP. Your phone 
lines don't work. Nobody is answering in live chat. I need my money back 
cuz this was the biggest waste of $60 in my life. "|https://news.google.com/stories/CAAqOQgKIjNDQklTSURvSmMzUnZjbmt0TXpZd1NoTUtFUWlYdTZLRGtJQU1FYVh0NEFrZmlJRU5LQUFQAQ?hl=en-US&gl=US&ceid=US%3Aen
"We’re seeing an accelerated need for Cloud and for people who can help our 
clients realize its full value. Welcome to the family @gekko_sas - a great 
addition to our @Accenture AWS Business Group in France, Belgium, 
Luxembourg & the Netherlands and our strong @awscloud solutions. 
"|https://news.google.com/stories/CAAqOQgKIjNDQklTSURvSmMzUnZjbmt0TXpZd1NoTUtFUWpNcC1xQ2tJQU1FWWllTjJLLWh1RzZLQUFQAQ?hl=en-US&gl=US&ceid=US%3Aen
"Exciting news coming soon from @awscloud - stoked to have been given a 
sneak peek briefing..."|https://news.google.com/stories/CAAqOQgKIjNDQklTSURvSmMzUnZjbmt0TXpZd1NoTUtFUWpNcC1xQ2tJQU1FWWllTjJLLWh1RzZLQUFQAQ?hl=en-US&gl=US&ceid=US%3Aen
