tweet|covering_link
"1/9 As the reckoning over racism continues in America, it’s time for 
corporations to lead the way to a more equitable future. This week alone, 
we have seen Quaker Oats & Uncle Ben’s remove racist icons on products like 
Aunt Jemima & Uncle Ben’s Converted Rice. #velshi"|https://news.google.com/stories/CAAqZggKImBDQklTUWpvSmMzUnZjbmt0TXpZd1NqVUtFUWprdE9xQ2tJQU1FZWxEQjNuTW1jQmNFaUJCZFc1MElFcGxiV2x0WVNCaWNtRnVaQ0IwYnlCamFHRnVaMlVnYm1GdFpTZ0FQAQ?hl=en-US&gl=US&ceid=US%3Aen
"Tentative date for Tesla Shareholder Meeting & Battery Day is Sept 15. Will 
include tour of cell production system."|https://news.google.com/stories/CAAqOQgKIjNDQklTSURvSmMzUnZjbmt0TXpZd1NoTUtFUWpoNW95RmtJQU1FVHRfTHgzTTVYWkdLQUFQAQ?hl=en-US&gl=US&ceid=US%3Aen
"Aw yeeeeah, today is a good day. After all the horrible fighting with my 
stupid Luddite HOA over installing a plug for my car (which I offered to 
pay for, including all subsequent electricity charges), a @Tesla 
supercharger has opened up less than 5 mins from where I live. 💃🏿 
"|https://news.google.com/stories/CAAqOQgKIjNDQklTSURvSmMzUnZjbmt0TXpZd1NoTUtFUWpoNW95RmtJQU1FVHRfTHgzTTVYWkdLQUFQAQ?hl=en-US&gl=US&ceid=US%3Aen
"Fine! If @elonmusk hasn’t figured out how to bring George Carlin back yet, 
we at least deserve a new season of @SouthPark 🙎🏼‍♀️"|https://news.google.com/stories/CAAqOQgKIjNDQklTSURvSmMzUnZjbmt0TXpZd1NoTUtFUWpoNW95RmtJQU1FVHRfTHgzTTVYWkdLQUFQAQ?hl=en-US&gl=US&ceid=US%3Aen
"In which @MattMackowiak argues Austin should not provide incentives to 
@Tesla for its new factory, pointing out the company has historically 
struggled to hit the hiring numbers in its previous incentive deals. 
"|https://news.google.com/stories/CAAqOQgKIjNDQklTSURvSmMzUnZjbmt0TXpZd1NoTUtFUWpoNW95RmtJQU1FVHRfTHgzTTVYWkdLQUFQAQ?hl=en-US&gl=US&ceid=US%3Aen
"Austin-Travis County residents: New orders are in place to help slow the 
spread of COVID-19. From now until Aug. 15, businesses must require face 
coverings for employees & visitors with some exceptions. Residents can call 
3-1-1 with concerns or questions. "|https://news.google.com/stories/CAAqOQgKIjNDQklTSURvSmMzUnZjbmt0TXpZd1NoTUtFUWl5OE9DRmtJQU1FYWlrSk84SUpjcFlLQUFQAQ?hl=en-US&gl=US&ceid=US%3Aen
"Starting to hear similar themes arise in Travis County community. Concerns 
over gentrification, of course, and also whether Tesla pays a living wage 
for Austin and nearby residents, and is a good corporate citizen. Tesla's 
response to Covid-19 restrictions coming up a lot."|https://news.google.com/stories/CAAqOQgKIjNDQklTSURvSmMzUnZjbmt0TXpZd1NoTUtFUWl5OE9DRmtJQU1FYWlrSk84SUpjcFlLQUFQAQ?hl=en-US&gl=US&ceid=US%3Aen
"#Austin & Travis County highs today via @lcra & @nws. Forecast -> 
"|https://news.google.com/stories/CAAqOQgKIjNDQklTSURvSmMzUnZjbmt0TXpZd1NoTUtFUWl5OE9DRmtJQU1FYWlrSk84SUpjcFlLQUFQAQ?hl=en-US&gl=US&ceid=US%3Aen
" #cbsaustinwx #atxwx @cbsaustin 
"|https://news.google.com/stories/CAAqOQgKIjNDQklTSURvSmMzUnZjbmt0TXpZd1NoTUtFUWl5OE9DRmtJQU1FYWlrSk84SUpjcFlLQUFQAQ?hl=en-US&gl=US&ceid=US%3Aen
"JUST IN: #Austin/Travis County reporting 506 new #COVID19 cases today, 
setting the new single day record. 418 yesterday, 295 on Friday. New total 
is 6,210."|https://news.google.com/stories/CAAqOQgKIjNDQklTSURvSmMzUnZjbmt0TXpZd1NoTUtFUWl5OE9DRmtJQU1FYWlrSk84SUpjcFlLQUFQAQ?hl=en-US&gl=US&ceid=US%3Aen
"Binged #ThePoliticianSeason2 this weekend and therefore have been listening 
to a lot of @BenSPLATT on Spotify. He is a gosh darned national treasure."|https://news.google.com/stories/CAAqbAgKImZDQklTUmpvSmMzUnZjbmt0TXpZd1Nqa0tFUWp5czhPRWtJQU1FWm5zZDZCSFQ4VGlFaVFuVkdobElGQnZiR2wwYVdOcFlXNG5JSE5sWVhOdmJpQXlJRzl1SUU1bGRHWnNhWGdvQUFQAQ?hl=en-US&gl=US&ceid=US%3Aen
"Hello @BenSPLATT. My student cohort member @CavanLemberg has been begging 
you to jump on a 20min Zoom call. I'll literally pay you $100 to hear this 
awesome kid out. That's how much it means to him... and me. He literally 
wants to bring more music programs to small schools! "|https://news.google.com/stories/CAAqbAgKImZDQklTUmpvSmMzUnZjbmt0TXpZd1Nqa0tFUWp5czhPRWtJQU1FWm5zZDZCSFQ4VGlFaVFuVkdobElGQnZiR2wwYVdOcFlXNG5JSE5sWVhOdmJpQXlJRzl1SUU1bGRHWnNhWGdvQUFQAQ?hl=en-US&gl=US&ceid=US%3Aen
"Lol omg @BenSPLATT your options for corner of the sky in s2 of 
#ThePoliticianNetflix 🤯🤯🤯"|https://news.google.com/stories/CAAqbAgKImZDQklTUmpvSmMzUnZjbmt0TXpZd1Nqa0tFUWp5czhPRWtJQU1FWm5zZDZCSFQ4VGlFaVFuVkdobElGQnZiR2wwYVdOcFlXNG5JSE5sWVhOdmJpQXlJRzl1SUU1bGRHWnNhWGdvQUFQAQ?hl=en-US&gl=US&ceid=US%3Aen
"The best part of #ThePoliticianSeason2 is @BenSPLATT singing... because, 
well, duh. "|https://news.google.com/stories/CAAqbAgKImZDQklTUmpvSmMzUnZjbmt0TXpZd1Nqa0tFUWp5czhPRWtJQU1FWm5zZDZCSFQ4VGlFaVFuVkdobElGQnZiR2wwYVdOcFlXNG5JSE5sWVhOdmJpQXlJRzl1SUU1bGRHWnNhWGdvQUFQAQ?hl=en-US&gl=US&ceid=US%3Aen
"Tentative date for Tesla Shareholder Meeting & Battery Day is Sept 15. Will 
include tour of cell production system."|https://news.google.com/stories/CAAqOQgKIjNDQklTSURvSmMzUnZjbmt0TXpZd1NoTUtFUWplekl5SGtJQU1FWk1DNlZSeDVOaDhLQUFQAQ?hl=en-US&gl=US&ceid=US%3Aen
"Aw yeeeeah, today is a good day. After all the horrible fighting with my 
stupid Luddite HOA over installing a plug for my car (which I offered to 
pay for, including all subsequent electricity charges), a @Tesla 
supercharger has opened up less than 5 mins from where I live. 💃🏿 
"|https://news.google.com/stories/CAAqOQgKIjNDQklTSURvSmMzUnZjbmt0TXpZd1NoTUtFUWplekl5SGtJQU1FWk1DNlZSeDVOaDhLQUFQAQ?hl=en-US&gl=US&ceid=US%3Aen
"Fine! If @elonmusk hasn’t figured out how to bring George Carlin back yet, 
we at least deserve a new season of @SouthPark 🙎🏼‍♀️"|https://news.google.com/stories/CAAqOQgKIjNDQklTSURvSmMzUnZjbmt0TXpZd1NoTUtFUWplekl5SGtJQU1FWk1DNlZSeDVOaDhLQUFQAQ?hl=en-US&gl=US&ceid=US%3Aen
"In which @MattMackowiak argues Austin should not provide incentives to 
@Tesla for its new factory, pointing out the company has historically 
struggled to hit the hiring numbers in its previous incentive deals. 
"|https://news.google.com/stories/CAAqOQgKIjNDQklTSURvSmMzUnZjbmt0TXpZd1NoTUtFUWplekl5SGtJQU1FWk1DNlZSeDVOaDhLQUFQAQ?hl=en-US&gl=US&ceid=US%3Aen
"Mel Gibson, Aubrey Huff, amd Mitch McConnell are all trending... Okay where 
is the Klan rally being held at?"|https://news.google.com/stories/CAAqOQgKIjNDQklTSURvSmMzUnZjbmt0TXpZd1NoTUtFUWlJZzRHR2tJQU1FY1oxNlk0bFBaLU1LQUFQAQ?hl=en-US&gl=US&ceid=US%3Aen
"The AMD Radeon 5600 XT is poetry in graphics card form. Would you like to 
win one? - Reply with your best haiku about the graphics card before July 
1st - Follow @AMD_AUNZ me and @Jenzlinger - Reply to @jenzlinger's AMD post 
for a SECOND chance to win! (AU and NZ entries only) "|https://news.google.com/stories/CAAqOQgKIjNDQklTSURvSmMzUnZjbmt0TXpZd1NoTUtFUWlJZzRHR2tJQU1FY1oxNlk0bFBaLU1LQUFQAQ?hl=en-US&gl=US&ceid=US%3Aen
"Hank Williams, Gram Parsons amd Jeff Buckley all sang the heck out of 
Satisfied Mind, a song about inner peace being more important than money. 
They all died by 30."|https://news.google.com/stories/CAAqOQgKIjNDQklTSURvSmMzUnZjbmt0TXpZd1NoTUtFUWlJZzRHR2tJQU1FY1oxNlk0bFBaLU1LQUFQAQ?hl=en-US&gl=US&ceid=US%3Aen
"HE DID IT! @StormChaseTV with a successful test of high-speed drone for 
deployment of sensor package into tornadoes amd other storms. He built this 
drone with his bare hands. We are hoping to deploy during northern Plains 
season. @ChasinSpin "|https://news.google.com/stories/CAAqOQgKIjNDQklTSURvSmMzUnZjbmt0TXpZd1NoTUtFUWlJZzRHR2tJQU1FY1oxNlk0bFBaLU1LQUFQAQ?hl=en-US&gl=US&ceid=US%3Aen
"$F Ford's Mustang Mach-E will add hands-free driving with a software update 
"|https://news.google.com/stories/CAAqOQgKIjNDQklTSURvSmMzUnZjbmt0TXpZd1NoTUtFUWpXX2ItQ2tJQU1FZXZIVVpZaWwtY1FLQUFQAQ?hl=en-US&gl=US&ceid=US%3Aen
"2021 Ford Mustang Mach-E Virtual First Drive: Hitting Its Mark 
"|https://news.google.com/stories/CAAqOQgKIjNDQklTSURvSmMzUnZjbmt0TXpZd1NoTUtFUWpXX2ItQ2tJQU1FZXZIVVpZaWwtY1FLQUFQAQ?hl=en-US&gl=US&ceid=US%3Aen
 via @motor1com|https://news.google.com/stories/CAAqOQgKIjNDQklTSURvSmMzUnZjbmt0TXpZd1NoTUtFUWpXX2ItQ2tJQU1FZXZIVVpZaWwtY1FLQUFQAQ?hl=en-US&gl=US&ceid=US%3Aen
"Hands-Free Driving Coming to 2021 Ford Mustang Mach-E 
"|https://news.google.com/stories/CAAqOQgKIjNDQklTSURvSmMzUnZjbmt0TXpZd1NoTUtFUWpXX2ItQ2tJQU1FZXZIVVpZaWwtY1FLQUFQAQ?hl=en-US&gl=US&ceid=US%3Aen
"Ford unveils 2021 Mustang Mach 1 as new global ‘pinnacle’ of pony car 
lineup "|https://news.google.com/stories/CAAqOQgKIjNDQklTSURvSmMzUnZjbmt0TXpZd1NoTUtFUWpXX2ItQ2tJQU1FZXZIVVpZaWwtY1FLQUFQAQ?hl=en-US&gl=US&ceid=US%3Aen
".@amazon is hosting its first-ever Big Style Sale this week with deals on 
all things fashion up to 50% off! I’m sharing more details including what 
you should hold off from buying today on the news at 3 & 4pm! @abc13houston"|https://news.google.com/stories/CAAqZQgKIl9DQklTUVRvSmMzUnZjbmt0TXpZd1NqUUtFUWprNzlhR2tJQU1FYkpBOGl5WEVuVktFaDlCYldGNmIyNG5jeUJDYVdjZ1UzUjViR1VnVTJGc1pTQnBjeUJvWlhKbEtBQVAB?hl=en-US&gl=US&ceid=US%3Aen
"Axios: Shopify goes after Amazon with new Walmart deal. Another example of 
a very bad title for an article. No need to brag, you don't sell fresh 
fish, and we would be interested anyways. "|https://news.google.com/stories/CAAqZQgKIl9DQklTUVRvSmMzUnZjbmt0TXpZd1NqUUtFUWprNzlhR2tJQU1FYkpBOGl5WEVuVktFaDlCYldGNmIyNG5jeUJDYVdjZ1UzUjViR1VnVTJGc1pTQnBjeUJvWlhKbEtBQVAB?hl=en-US&gl=US&ceid=US%3Aen
"Adobe’s Lightroom and Photoshop for iPad now offer a seamless experience 
for passing images back and forth, fixing a key workflow pain point for 
users. @johnvoorhees has all the details. "|https://news.google.com/stories/CAAqOQgKIjNDQklTSURvSmMzUnZjbmt0TXpZd1NoTUtFUWlMMU1XMGpvQU1FVjhUbHZ6TVB1N2FLQUFQAQ?hl=en-US&gl=US&ceid=US%3Aen
" 
"|https://news.google.com/stories/CAAqOQgKIjNDQklTSURvSmMzUnZjbmt0TXpZd1NoTUtFUWlMMU1XMGpvQU1FVjhUbHZ6TVB1N2FLQUFQAQ?hl=en-US&gl=US&ceid=US%3Aen
"Dusty Baker has been keeping an eye on the rising COVID-19 numbers in 
Houston. ""I got about 100 different masks. I've got some gloves, I've got 
sunglasses. I read all the reports on what to do and how to stay good."""|https://news.google.com/stories/CAAqOQgKIjNDQklTSURvSmMzUnZjbmt0TXpZd1NoTUtFUWo1dnFHSWtJQU1FZDRBVEFlaWtmOGxLQUFQAQ?hl=en-US&gl=US&ceid=US%3Aen
"Dusty Baker, 71: ""I've seen the reports in Houston, how COVID's gone up. 
I'm going to have to really be careful. I've got about 100 different masks. 
I've got some gloves. I've got sunglasses. I've got all the reports on what 
to do and how to stay good."""|https://news.google.com/stories/CAAqOQgKIjNDQklTSURvSmMzUnZjbmt0TXpZd1NoTUtFUWo1dnFHSWtJQU1FZDRBVEFlaWtmOGxLQUFQAQ?hl=en-US&gl=US&ceid=US%3Aen
"Sunglasses this morning. Where you'll need an umbrella this 
afternoon....now on Channel 11 Morning News. Watch live ---> 
"|https://news.google.com/stories/CAAqOQgKIjNDQklTSURvSmMzUnZjbmt0TXpZd1NoTUtFUWo1dnFHSWtJQU1FZDRBVEFlaWtmOGxLQUFQAQ?hl=en-US&gl=US&ceid=US%3Aen
 |https://news.google.com/stories/CAAqOQgKIjNDQklTSURvSmMzUnZjbmt0TXpZd1NoTUtFUWo1dnFHSWtJQU1FZDRBVEFlaWtmOGxLQUFQAQ?hl=en-US&gl=US&ceid=US%3Aen
"MXMASTERMKE official MMMFLY Sunglasses Courtesy of @blackflysusa AVAILABLE 
NOW "|https://news.google.com/stories/CAAqOQgKIjNDQklTSURvSmMzUnZjbmt0TXpZd1NoTUtFUWo1dnFHSWtJQU1FZDRBVEFlaWtmOGxLQUFQAQ?hl=en-US&gl=US&ceid=US%3Aen
Hello @Yellowstone , goodbye ever sleeping again. #CantStopWontStop|https://news.google.com/stories/CAAqZQgKIl9DQklTUVRvSmMzUnZjbmt0TXpZd1NqUUtFUWpsN2FxSGtJQU1FUS1LOXotOGlCenZFaDhuV1dWc2JHOTNjM1J2Ym1VbklGTmxZWE52YmlBeklIQnlaVzFwWlhKbEtBQVAB?hl=en-US&gl=US&ceid=US%3Aen
"Okay that's five ads I've seen about #YellowstoneTV ... Is this show really 
that good? Do I need to start watching from the beginning? I know it stars 
Kevin Costner and I don't know if I've forgiven him for his terrible low 
level racist 2014 film ""Black or White"" yet.... 😐"|https://news.google.com/stories/CAAqZQgKIl9DQklTUVRvSmMzUnZjbmt0TXpZd1NqUUtFUWpsN2FxSGtJQU1FUS1LOXotOGlCenZFaDhuV1dWc2JHOTNjM1J2Ym1VbklGTmxZWE52YmlBeklIQnlaVzFwWlhKbEtBQVAB?hl=en-US&gl=US&ceid=US%3Aen
"4.2 million people watched 1st airing of Sunday's #Yellowstone Season 3 
premiere. Easily the highest-rated episode of the series so far. This show 
is now clearly in its ""really popular period"" (though you'd think a TV 
series with Kevin Costner would've been huge out of the gate). 
"|https://news.google.com/stories/CAAqZQgKIl9DQklTUVRvSmMzUnZjbmt0TXpZd1NqUUtFUWpsN2FxSGtJQU1FUS1LOXotOGlCenZFaDhuV1dWc2JHOTNjM1J2Ym1VbklGTmxZWE52YmlBeklIQnlaVzFwWlhKbEtBQVAB?hl=en-US&gl=US&ceid=US%3Aen
"Do you believe Teddy Roosevelt, former president & godfather of American 
conservation, is being #canceled? Does he deserve to be canceled? Listen to 
EP 87 of @DConservPodcast where I explore this. Plus - why I LOVE 
@Yellowstone and you will too. "|https://news.google.com/stories/CAAqZQgKIl9DQklTUVRvSmMzUnZjbmt0TXpZd1NqUUtFUWpsN2FxSGtJQU1FUS1LOXotOGlCenZFaDhuV1dWc2JHOTNjM1J2Ym1VbklGTmxZWE52YmlBeklIQnlaVzFwWlhKbEtBQVAB?hl=en-US&gl=US&ceid=US%3Aen
"iOS 14 has a new Back Tap feature in Accessibility and it's wild. You can 
perform quick actions by double- or triple-tapping the *back of your 
iPhone*. Literally quick taps on the back; works with a case on. These 
include system actions as well as custom shortcuts. "|https://news.google.com/stories/CAAqfQgKIndDQklTVXpvSmMzUnZjbmt0TXpZd1NrWUtFUWlFaE1tSWtJQU1FYTkyTmQ5SmxCTVhFakZCY0hCc1pTZHpJRmR2Y214a2QybGtaU0JFWlhabGJHOXdaWEp6SUVOdmJtWmxjbVZ1WTJVZ2NISmxkbWxsZDJWa0tBQVAB?hl=en-US&gl=US&ceid=US%3Aen
"iOS 14 comes with support for Sound Recognition in Accessibility. Your 
phone can now listen for specific sounds – a baby crying, smoke alarm, 
water running, etc. – and notify you. Amazing feature for all kinds of 
users – inclusivity at its best. #WWDC2020 "|https://news.google.com/stories/CAAqfQgKIndDQklTVXpvSmMzUnZjbmt0TXpZd1NrWUtFUWlFaE1tSWtJQU1FYTkyTmQ5SmxCTVhFakZCY0hCc1pTZHpJRmR2Y214a2QybGtaU0JFWlhabGJHOXdaWEp6SUVOdmJtWmxjbVZ1WTJVZ2NISmxkbWxsZDJWa0tBQVAB?hl=en-US&gl=US&ceid=US%3Aen
"With Back Tap, you can perform various action by double or tripple tap on 
the back of your iPhone. Here’s one I set double tap to take screenshot. 
"|https://news.google.com/stories/CAAqfQgKIndDQklTVXpvSmMzUnZjbmt0TXpZd1NrWUtFUWlFaE1tSWtJQU1FYTkyTmQ5SmxCTVhFakZCY0hCc1pTZHpJRmR2Y214a2QybGtaU0JFWlhabGJHOXdaWEp6SUVOdmJtWmxjbVZ1WTJVZ2NISmxkbWxsZDJWa0tBQVAB?hl=en-US&gl=US&ceid=US%3Aen
Buried on the iOS and iPadOS feature slide... |https://news.google.com/stories/CAAqfQgKIndDQklTVXpvSmMzUnZjbmt0TXpZd1NrWUtFUWlFaE1tSWtJQU1FYTkyTmQ5SmxCTVhFakZCY0hCc1pTZHpJRmR2Y214a2QybGtaU0JFWlhabGJHOXdaWEp6SUVOdmJtWmxjbVZ1WTJVZ2NISmxkbWxsZDJWa0tBQVAB?hl=en-US&gl=US&ceid=US%3Aen
"Wow. I'm literally stunned. Apple just doubled down on their rejection of 
HEY's ability to provide bug fixes and new features, unless we submit to 
their outrageous demand of 15-30% of our revenue. Even worse: We're told 
that unless we comply, they'll REMOVE THE APP."|https://news.google.com/stories/CAAqOQgKIjNDQklTSURvSmMzUnZjbmt0TXpZd1NoTUtFUWpnMzVhRmtJQU1FZWhvWFBMcTUyQWRLQUFQAQ?hl=en-US&gl=US&ceid=US%3Aen
"For all the snark and exasperation, we're going to take @pschiller up on 
this offer: ""There are many things that they could do to make the app work 
within the rules that we have. We would love for them to do that"". We won't 
ever do IAP, but try some of the other ""many things""."|https://news.google.com/stories/CAAqOQgKIjNDQklTSURvSmMzUnZjbmt0TXpZd1NoTUtFUWpnMzVhRmtJQU1FZWhvWFBMcTUyQWRLQUFQAQ?hl=en-US&gl=US&ceid=US%3Aen
"I just had an entire convo with an @Apple rep who totally failed even the 
basic Turing test. Me: Question Rep: Yes, here's an answer to a different 
question Me: But that's not my question Rep: Oh, okay, here's the same 
answer "|https://news.google.com/stories/CAAqOQgKIjNDQklTSURvSmMzUnZjbmt0TXpZd1NoTUtFUWpnMzVhRmtJQU1FZWhvWFBMcTUyQWRLQUFQAQ?hl=en-US&gl=US&ceid=US%3Aen
"Apple screws around with App Store billing (2019 revenue: ~$15bn): all hell 
breaks looks Apple starts to dismantle half the online ad business…🦗"|https://news.google.com/stories/CAAqOQgKIjNDQklTSURvSmMzUnZjbmt0TXpZd1NoTUtFUWpnMzVhRmtJQU1FZWhvWFBMcTUyQWRLQUFQAQ?hl=en-US&gl=US&ceid=US%3Aen
"iOS 14 has a new Back Tap feature in Accessibility and it's wild. You can 
perform quick actions by double- or triple-tapping the *back of your 
iPhone*. Literally quick taps on the back; works with a case on. These 
include system actions as well as custom shortcuts. "|https://news.google.com/stories/CAAqOQgKIjNDQklTSURvSmMzUnZjbmt0TXpZd1NoTUtFUWlSeUpxQ2tJQU1FU2l6SlpzbHBMQlZLQUFQAQ?hl=en-US&gl=US&ceid=US%3Aen
"iOS 14 comes with support for Sound Recognition in Accessibility. Your 
phone can now listen for specific sounds – a baby crying, smoke alarm, 
water running, etc. – and notify you. Amazing feature for all kinds of 
users – inclusivity at its best. #WWDC2020 "|https://news.google.com/stories/CAAqOQgKIjNDQklTSURvSmMzUnZjbmt0TXpZd1NoTUtFUWlSeUpxQ2tJQU1FU2l6SlpzbHBMQlZLQUFQAQ?hl=en-US&gl=US&ceid=US%3Aen
"With Back Tap, you can perform various action by double or tripple tap on 
the back of your iPhone. Here’s one I set double tap to take screenshot. 
"|https://news.google.com/stories/CAAqOQgKIjNDQklTSURvSmMzUnZjbmt0TXpZd1NoTUtFUWlSeUpxQ2tJQU1FU2l6SlpzbHBMQlZLQUFQAQ?hl=en-US&gl=US&ceid=US%3Aen
Buried on the iOS and iPadOS feature slide... |https://news.google.com/stories/CAAqOQgKIjNDQklTSURvSmMzUnZjbmt0TXpZd1NoTUtFUWlSeUpxQ2tJQU1FU2l6SlpzbHBMQlZLQUFQAQ?hl=en-US&gl=US&ceid=US%3Aen
"Wow. I'm literally stunned. Apple just doubled down on their rejection of 
HEY's ability to provide bug fixes and new features, unless we submit to 
their outrageous demand of 15-30% of our revenue. Even worse: We're told 
that unless we comply, they'll REMOVE THE APP."|https://news.google.com/stories/CAAqOQgKIjNDQklTSURvSmMzUnZjbmt0TXpZd1NoTUtFUWpkOWI2SGtJQU1FZXg2bngxcHctQ0RLQUFQAQ?hl=en-US&gl=US&ceid=US%3Aen
"For all the snark and exasperation, we're going to take @pschiller up on 
this offer: ""There are many things that they could do to make the app work 
within the rules that we have. We would love for them to do that"". We won't 
ever do IAP, but try some of the other ""many things""."|https://news.google.com/stories/CAAqOQgKIjNDQklTSURvSmMzUnZjbmt0TXpZd1NoTUtFUWpkOWI2SGtJQU1FZXg2bngxcHctQ0RLQUFQAQ?hl=en-US&gl=US&ceid=US%3Aen
"I just had an entire convo with an @Apple rep who totally failed even the 
basic Turing test. Me: Question Rep: Yes, here's an answer to a different 
question Me: But that's not my question Rep: Oh, okay, here's the same 
answer "|https://news.google.com/stories/CAAqOQgKIjNDQklTSURvSmMzUnZjbmt0TXpZd1NoTUtFUWpkOWI2SGtJQU1FZXg2bngxcHctQ0RLQUFQAQ?hl=en-US&gl=US&ceid=US%3Aen
"Apple screws around with App Store billing (2019 revenue: ~$15bn): all hell 
breaks looks Apple starts to dismantle half the online ad business…🦗"|https://news.google.com/stories/CAAqOQgKIjNDQklTSURvSmMzUnZjbmt0TXpZd1NoTUtFUWpkOWI2SGtJQU1FZXg2bngxcHctQ0RLQUFQAQ?hl=en-US&gl=US&ceid=US%3Aen
"Biogen's patent on its blockbuster MS drug Tecfidera invalidated by judge 
in West Virginia, opening door to Mylan's generic, possibly within days."|https://news.google.com/stories/CAAqOQgKIjNDQklTSURvSmMzUnZjbmt0TXpZd1NoTUtFUWpocGZ5RGtJQU1FWGRuLWp1d3c3eExLQUFQAQ?hl=en-US&gl=US&ceid=US%3Aen
"The sides are squared off, just like the rumored #iPhone12 #iPhone12Pro 
"|https://news.google.com/stories/CAAqOQgKIjNDQklTSURvSmMzUnZjbmt0TXpZd1NoTUtFUWo4dmJ2LWo0QU1FV3hYcGxqdFN4a0FLQUFQAQ?hl=en-US&gl=US&ceid=US%3Aen
"Apple’s “foldable” iPhone isn’t really a foldable. 🧐 The current prototype 
has two separate display panels on a hinge. Round, stainless steel edges 
like current iPhone 11 design. No notch — tiny forehead on outter display 
that houses Face ID."|https://news.google.com/stories/CAAqOQgKIjNDQklTSURvSmMzUnZjbmt0TXpZd1NoTUtFUWo4dmJ2LWo0QU1FV3hYcGxqdFN4a0FLQUFQAQ?hl=en-US&gl=US&ceid=US%3Aen
"The memes are funny — but it doesn’t look like they just stuck two phones 
together. Even though they’re two separate panels, when the displays are 
extended, it looks fairly continuous and seamless."|https://news.google.com/stories/CAAqOQgKIjNDQklTSURvSmMzUnZjbmt0TXpZd1NoTUtFUWo4dmJ2LWo0QU1FV3hYcGxqdFN4a0FLQUFQAQ?hl=en-US&gl=US&ceid=US%3Aen
"I just had an entire convo with an @Apple rep who totally failed even the 
basic Turing test. Me: Question Rep: Yes, here's an answer to a different 
question Me: But that's not my question Rep: Oh, okay, here's the same 
answer "|https://news.google.com/stories/CAAqOQgKIjNDQklTSURvSmMzUnZjbmt0TXpZd1NoTUtFUWo4dmJ2LWo0QU1FV3hYcGxqdFN4a0FLQUFQAQ?hl=en-US&gl=US&ceid=US%3Aen
"Research firm @AB_insights raises price target for Reliance @flameoftruth 
to Rs 1,870/share. ""Our valuations for downstream & @reliancejio remain 
largely unchanged. Increase in target price comes primarily from higher 
valuations for retail, media & other marketable investments."" 
"|https://news.google.com/stories/CAAqOQgKIjNDQklTSURvSmMzUnZjbmt0TXpZd1NoTUtFUWppd01fS2o0QU1FWksyVXBwQ19MTENLQUFQAQ?hl=en-US&gl=US&ceid=US%3Aen
"The Information: How India’s Jio Won Facebook’s Heart 
"|https://news.google.com/stories/CAAqOQgKIjNDQklTSURvSmMzUnZjbmt0TXpZd1NoTUtFUWppd01fS2o0QU1FWksyVXBwQ19MTENLQUFQAQ?hl=en-US&gl=US&ceid=US%3Aen
"The way #Jio is rising, I predict a new world order in tech with India 
leading the pack. Move over FAANGS (Facebook Apple Amazon Netflix Google) & 
BAT(Baidu Alibaba Tencent). Tech world’s going to be JAANGO (Jio Amazon 
Apple Netflix Google and the Others) soon! #IndiaRising"|https://news.google.com/stories/CAAqOQgKIjNDQklTSURvSmMzUnZjbmt0TXpZd1NoTUtFUWppd01fS2o0QU1FWksyVXBwQ19MTENLQUFQAQ?hl=en-US&gl=US&ceid=US%3Aen
"Thanks to Ambani’s Jio deals, Reliance meets zero net debt goal 9 months 
ahead of target P.R. Sanjai @talktosanjai and Nikhil Patwardhan 
@patwardhannn report "|https://news.google.com/stories/CAAqOQgKIjNDQklTSURvSmMzUnZjbmt0TXpZd1NoTUtFUWppd01fS2o0QU1FWksyVXBwQ19MTENLQUFQAQ?hl=en-US&gl=US&ceid=US%3Aen
"iOS 14 has a new Back Tap feature in Accessibility and it's wild. You can 
perform quick actions by double- or triple-tapping the *back of your 
iPhone*. Literally quick taps on the back; works with a case on. These 
include system actions as well as custom shortcuts. "|https://news.google.com/stories/CAAqOQgKIjNDQklTSURvSmMzUnZjbmt0TXpZd1NoTUtFUWprLVBpSGtJQU1FUWpVVXhGU3ZzTThLQUFQAQ?hl=en-US&gl=US&ceid=US%3Aen
"iOS 14 comes with support for Sound Recognition in Accessibility. Your 
phone can now listen for specific sounds – a baby crying, smoke alarm, 
water running, etc. – and notify you. Amazing feature for all kinds of 
users – inclusivity at its best. #WWDC2020 "|https://news.google.com/stories/CAAqOQgKIjNDQklTSURvSmMzUnZjbmt0TXpZd1NoTUtFUWprLVBpSGtJQU1FUWpVVXhGU3ZzTThLQUFQAQ?hl=en-US&gl=US&ceid=US%3Aen
"With Back Tap, you can perform various action by double or tripple tap on 
the back of your iPhone. Here’s one I set double tap to take screenshot. 
"|https://news.google.com/stories/CAAqOQgKIjNDQklTSURvSmMzUnZjbmt0TXpZd1NoTUtFUWprLVBpSGtJQU1FUWpVVXhGU3ZzTThLQUFQAQ?hl=en-US&gl=US&ceid=US%3Aen
Buried on the iOS and iPadOS feature slide... |https://news.google.com/stories/CAAqOQgKIjNDQklTSURvSmMzUnZjbmt0TXpZd1NoTUtFUWprLVBpSGtJQU1FUWpVVXhGU3ZzTThLQUFQAQ?hl=en-US&gl=US&ceid=US%3Aen
Skate is Back! |https://news.google.com/stories/CAAqOQgKIjNDQklTSURvSmMzUnZjbmt0TXpZd1NoTUtFUWlzdVpxQ2tJQU1FVWd3RFRuS1hXeVJLQUFQAQ?hl=en-US&gl=US&ceid=US%3Aen
"I am so hyped right now, this is so much more than I would have guessed 
after the initial trailer leak, this has temendous potential Star Wars: 
Squadrons - FULL Gameplay Reveal Presentation | EA Play 2020 
"|https://news.google.com/stories/CAAqOQgKIjNDQklTSURvSmMzUnZjbmt0TXpZd1NoTUtFUWlzdVpxQ2tJQU1FVWd3RFRuS1hXeVJLQUFQAQ?hl=en-US&gl=US&ceid=US%3Aen
 via @YouTube|https://news.google.com/stories/CAAqOQgKIjNDQklTSURvSmMzUnZjbmt0TXpZd1NoTUtFUWlzdVpxQ2tJQU1FVWd3RFRuS1hXeVJLQUFQAQ?hl=en-US&gl=US&ceid=US%3Aen
"Our Angry Reaction to the Gameplay Trailer for the upcoming new @EAStarWars 
Game, Star Wars: Squadrons! The one bright spot in the EA Plays 2020 
Digital Press Conference! Looks AWESOME! "|https://news.google.com/stories/CAAqOQgKIjNDQklTSURvSmMzUnZjbmt0TXpZd1NoTUtFUWlzdVpxQ2tJQU1FVWd3RFRuS1hXeVJLQUFQAQ?hl=en-US&gl=US&ceid=US%3Aen
" RT Plz! 
"|https://news.google.com/stories/CAAqOQgKIjNDQklTSURvSmMzUnZjbmt0TXpZd1NoTUtFUWlzdVpxQ2tJQU1FVWd3RFRuS1hXeVJLQUFQAQ?hl=en-US&gl=US&ceid=US%3Aen
"So I think I want to go all in for Star Wars Squadrons and get a flight 
stick and whatever else I may need (not VR cause mah glasses). 1. What are 
some good flight stick options? 2. What are some great space flight games I 
can play in the meantime? 3. Thank you ❤️"|https://news.google.com/stories/CAAqOQgKIjNDQklTSURvSmMzUnZjbmt0TXpZd1NoTUtFUWlzdVpxQ2tJQU1FVWd3RFRuS1hXeVJLQUFQAQ?hl=en-US&gl=US&ceid=US%3Aen
"Is James Comey and his band of Dirty Cops going to apologize to General 
Michael Flynn (and many others) for what they have done to ruin his life? 
What about Robert Mueller and his Angry Democrat Cronies - Are they going 
to say, SO SORRY? And what about Obama & Biden?"|https://news.google.com/stories/CAAqOQgKIjNDQklTSURvSmMzUnZjbmt0TXpZd1NoTUtFUWlqZ0tPSWtJQU1FVXZpWHFlamVmdzlLQUFQAQ?hl=en-US&gl=US&ceid=US%3Aen
"The Chinese Communist Party is behaving in ways that fundamentally put the 
American people’s security at risk. The @realDonaldTrump Administration is 
the first in decades to take this threat seriously."|https://news.google.com/stories/CAAqOQgKIjNDQklTSURvSmMzUnZjbmt0TXpZd1NoTUtFUWlqZ0tPSWtJQU1FVXZpWHFlamVmdzlLQUFQAQ?hl=en-US&gl=US&ceid=US%3Aen
